Book ID,Title_x,Author,Publication Date,Language,LoC Class,Subjects,Link,Title_y,Date,Most Common Words
1514,A Midsummer Night's Dream by William Shakespeare (105),"Shakespeare, William, 1564-1616","Nov 1, 1998",English,PR: Language and Literatures: English literature,"Comedies, Courtship -- Drama, Athens (Greece) -- Drama, Fairy plays",https://www.gutenberg.org/ebooks/1514,A Midsummer Night's Dream by William Shakespeare (105),"Nov 1, 1998","[('thou', 116), ('love', 104), ('lysander', 100), ('hermia', 96), ('demetrius', 96), ('project', 84), ('shall', 74), ('helena', 68), ('theseus', 67), ('thy', 65), ('bottom', 64), ('thee', 64), ('gutenbergâ', 61), ('come', 60), ('pyramus', 57), ('must', 54), ('enter', 53), ('quince', 51), ('puck', 49), ('work', 49), ('may', 46), ('man', 46), ('sweet', 46), ('oberon', 45), ('thisbe', 44), ('one', 44), ('night', 43), ('good', 42), ('see', 42), ('eyes', 41)]"
40682,"Lulu's Library, Volume 1 (of 3) (104)",Unknown,Unknown,Unknown,Unknown,,https://www.gutenberg.org/ebooks/40682,"Lulu's Library, Volume 1 (of 3) (104)",Unknown,"[('little', 311), ('said', 240), ('one', 227), ('like', 198), ('see', 189), ('could', 165), ('go', 155), ('went', 142), ('away', 134), ('good', 134), ('come', 121), ('would', 114), ('till', 112), ('poor', 111), ('came', 106), ('get', 101), ('old', 99), ('never', 97), ('much', 95), ('day', 93), ('work', 91), ('great', 90), ('nât', 89), ('time', 85), ('got', 83), ('âll', 82), ('project', 81), ('donât', 81), ('made', 79), ('johnny', 77)]"
815,Democracy in America — Volume 1 by Alexis de Tocqueville (104),"Tocqueville, Alexis de, 1805-1859","Jan 21, 2006",English,JK: Political science: Political inst. and pub. Admin.: United States,"United States -- Politics and government, United States -- Social conditions, Democracy -- United States",https://www.gutenberg.org/ebooks/815,Democracy in America — Volume 1 by Alexis de Tocqueville (104),"Jan 21, 2006","[('states', 932), ('may', 646), ('upon', 612), ('united', 570), ('power', 537), ('government', 525), ('people', 491), ('state', 489), ('union', 428), ('one', 420), ('laws', 388), ('america', 368), ('would', 365), ('great', 353), ('country', 342), ('without', 334), ('men', 309), ('public', 308), ('new', 306), ('time', 306), ('authority', 299), ('political', 295), ('american', 287), ('society', 283), ('federal', 259), ('law', 240), ('two', 238), ('americans', 238), ('must', 235), ('influence', 228)]"
21700,Don Juan by Baron George Gordon Byron Byron (104),Unknown,Unknown,Unknown,Unknown,,https://www.gutenberg.org/ebooks/21700,Don Juan by Baron George Gordon Byron Byron (104),Unknown,"[('like', 505), ('one', 381), ('may', 313), ('much', 312), ('juan', 302), ('would', 302), ('could', 292), ('though', 284), ('âs', 276), ('upon', 274), ('âtis', 251), ('still', 246), ('yet', 238), ('must', 210), ('great', 202), ('love', 198), ('made', 189), ('good', 188), ('little', 183), ('might', 180), ('oâer', 178), ('say', 177), ('even', 167), ('old', 163), ('men', 160), ('without', 159), ('know', 156), ('things', 156), ('time', 155), ('first', 154)]"
70114,The Big Four by Agatha Christie (103),"Christie, Agatha, 1890-1976","Feb 23, 2023",English,PR: Language and Literatures: English literature,"Private investigators -- England -- Fiction, Detective and mystery stories, English, Murder -- Investigation -- Fiction, Poirot, Hercule (Fictitious character) -- Fiction, Mystery fiction, Secret societies -- Fiction",https://www.gutenberg.org/ebooks/70114,,,
4517,Ethan Frome by Edith Wharton (103),"Wharton, Edith, 1862-1937","Oct 1, 2003",English,PS: Language and Literatures: American and Canadian literature,"Domestic fiction, New England -- Fiction, Married people -- Fiction, Triangles (Interpersonal relations) -- Fiction, Accident victims -- Fiction, Rural poor -- Fiction",https://www.gutenberg.org/ebooks/4517,Ethan Frome by Edith Wharton (103),"Oct 1, 2003","[('ethan', 176), ('mattie', 131), ('said', 114), ('back', 104), ('zeena', 89), ('project', 88), ('like', 81), ('could', 80), ('one', 78), ('âi', 76), ('seemed', 66), ('would', 62), ('work', 62), ('know', 59), ('went', 59), ('night', 57), ('starkfield', 56), ('stood', 56), ('gutenbergtm', 56), ('felt', 55), ('time', 54), ('long', 54), ('face', 52), ('hand', 51), ('go', 51), ('frome', 50), ('turned', 50), ('thought', 49), ('without', 48), ('never', 48)]"
2,The United States Bill of Rights by United States (102),United States,"Dec 1, 1972",English,JK: Political science: Political inst. and pub. Admin.: United States,"Civil rights -- United States -- Sources, United States. Constitution. 1st-10th Amendments",https://www.gutenberg.org/ebooks/2,,,
519,A Kidnapped Santa Claus by L. Frank  Baum (102),"Baum, L. Frank (Lyman Frank), 1856-1919","May 1, 1996",English,PZ: Language and Literatures: Juvenile belles lettres,"Fantasy literature, Christmas stories, Santa Claus -- Juvenile fiction",https://www.gutenberg.org/ebooks/519,,,
20738,Diccionario Ingles-Español-Tagalog by Sofronio G. Calderón (102),"Calderón, Sofronio G., 1878-1954?","Mar 4, 2007",English,"PL: Language and Literatures: Languages and literatures of Eastern Asia, Africa, Oceania","English language -- Dictionaries -- Spanish, English language -- Dictionaries -- Tagalog, English language -- Dictionaries -- Polyglot",https://www.gutenberg.org/ebooks/20738,,,
2707,The History of Herodotus — Volume 1 by Herodotus (101),"Herodotus, 480? BCE-420? BCE","Jul 1, 2001",English,D: History: General and Eastern Hemisphere,"History, Ancient, Greece -- History -- To 146 B.C.",https://www.gutenberg.org/ebooks/2707,,,
11231,"Bartleby, the Scrivener: A Story of Wall-Street by Herman Melville (101)","Melville, Herman, 1819-1891","Feb 1, 2004",English,PS: Language and Literatures: American and Canadian literature,"New York (N.Y.) -- Fiction, Psychological fiction, Young men -- Fiction, Wall Street (New York, N.Y.) -- Fiction, Copyists -- Fiction",https://www.gutenberg.org/ebooks/11231,"Bartleby, the Scrivener: A Story of Wall-Street by Herman Melville (101)","Feb 1, 2004","[('bartleby', 101), ('would', 96), ('project', 89), ('upon', 68), ('said', 57), ('gutenbergtm', 56), ('one', 52), ('work', 49), ('âi', 39), ('must', 37), ('office', 36), ('man', 35), ('could', 32), ('works', 32), ('gutenberg', 31), ('turkey', 31), ('prefer', 31), ('thought', 30), ('nippers', 28), ('nothing', 27), ('electronic', 27), ('may', 25), ('business', 25), ('time', 25), ('without', 25), ('might', 24), ('never', 24), ('like', 24), ('morning', 24), ('terms', 23)]"
72277,Thunder in space by Lester Del Rey (101),"Del Rey, Lester, 1915-1993","Dec 1, 2023",English,PS: Language and Literatures: American and Canadian literature,"Science fiction, Space stations -- Fiction, Weapons -- Fiction, Cold War -- Fiction",https://www.gutenberg.org/ebooks/72277,Thunder in space by Lester Del Rey (101),"Dec 1, 2023","[('blane', 103), ('could', 62), ('station', 54), ('earth', 50), ('would', 47), ('space', 44), ('peal', 42), ('ship', 36), ('one', 31), ('time', 31), ('manners', 29), ('make', 28), ('men', 27), ('back', 27), ('enough', 25), ('ships', 25), ('without', 23), ('_sulky_', 23), ('even', 22), ('devlin', 22), ('must', 22), ('still', 21), ('_goddard_', 21), ('us', 20), ('began', 20), ('edwards', 20), ('little', 19), ('might', 19), ('much', 19), ('already', 18)]"
5230,The Invisible Man: A Grotesque Romance by H. G.  Wells (100),"Wells, H. G. (Herbert George), 1866-1946","Mar 1, 2004",English,PR: Language and Literatures: English literature,"Science fiction, Psychological fiction, Scientists -- Fiction, Mentally ill -- Fiction",https://www.gutenberg.org/ebooks/5230,The Invisible Man: A Grotesque Romance by H. G.  Wells (100),"Mar 1, 2004","[('said', 531), ('mr', 222), ('man', 221), ('kemp', 200), ('invisible', 168), ('door', 156), ('âi', 143), ('came', 142), ('hall', 141), ('went', 138), ('one', 134), ('little', 114), ('marvel', 113), ('room', 95), ('could', 91), ('project', 90), ('voice', 90), ('back', 88), ('face', 86), ('mrs', 84), ('would', 84), ('must', 84), ('like', 82), ('saw', 82), ('suddenly', 78), ('stood', 77), ('heard', 76), ('made', 76), ('work', 72), ('window', 71)]"
16643,Essays by Ralph Waldo Emerson by Ralph Waldo Emerson (100),Unknown,Unknown,Unknown,Unknown,,https://www.gutenberg.org/ebooks/16643,Essays by Ralph Waldo Emerson by Ralph Waldo Emerson (100),Unknown,"[('footnote', 716), ('man', 382), ('one', 301), ('men', 255), ('nature', 249), ('us', 231), ('every', 230), ('great', 226), ('see', 201), ('life', 175), ('must', 173), ('world', 169), ('new', 168), ('may', 158), ('good', 152), ('emerson', 141), ('shall', 135), ('like', 129), ('time', 128), ('let', 126), ('work', 121), ('english', 119), ('would', 118), ('first', 117), ('yet', 115), ('thought', 112), ('much', 111), ('cannot', 107), ('love', 106), ('without', 104)]"
22367,Die Verwandlung by Franz Kafka (100),"Kafka, Franz, 1883-1924","Aug 21, 2007",German,"PT: Language and Literatures: Germanic, Scandinavian, and Icelandic literatures","Psychological fiction, Metamorphosis -- Fiction",https://www.gutenberg.org/ebooks/22367,,,
72287,The history of a tame robin by Anonymous (99),Anonymous,"Dec 2, 2023",English,Unknown,,https://www.gutenberg.org/ebooks/72287,,,
45109,The Enchiridion by Epictetus (99),"Epictetus, 55-135","Mar 10, 2014",English,"B: Philosophy, Psychology, Religion","Conduct of life -- Early works to 1800, Ethics, Ancient",https://www.gutenberg.org/ebooks/45109,The Enchiridion by Epictetus (99),"Mar 10, 2014","[('lla', 107), ('project', 83), ('tr', 66), ('gutenbergâ', 61), ('things', 50), ('work', 48), ('ââ', 45), ('may', 44), ('one', 37), ('works', 35), ('power', 34), ('must', 32), ('stoic', 28), ('thus', 27), ('therefore', 27), ('electronic', 27), ('gutenberg', 26), ('philosopher', 23), ('say', 23), ('epictetus', 22), ('terms', 22), ('use', 21), ('anyone', 21), ('states', 21), ('foundation', 21), ('50', 21), ('_the', 21), ('within', 21), ('copyright', 20), ('philosophy', 20)]"
994,Riders to the Sea by J. M.  Synge (99),"Synge, J. M. (John Millington), 1871-1909","Jul 1, 1997",English,PR: Language and Literatures: English literature,"Ireland -- Drama, Mothers and sons -- Drama, Drowning victims -- Drama, Seafaring life -- Drama",https://www.gutenberg.org/ebooks/994,Riders to the Sea by J. M.  Synge (99),"Jul 1, 1997","[('project', 88), ('cathleen', 62), ('nora', 56), ('gutenbergtm', 56), ('work', 48), ('maurya', 34), ('works', 32), ('gutenberg', 31), ('itâs', 29), ('bartley', 27), ('electronic', 27), ('one', 25), ('may', 23), ('sea', 22), ('foundation', 22), ('terms', 21), ('god', 21), ('man', 20), ('would', 20), ('us', 19), ('copyright', 19), ('great', 18), ('old', 18), ('states', 18), ('agreement', 18), ('michael', 17), ('must', 16), ('license', 15), ('literary', 15), ('way', 15)]"
9662,An Enquiry Concerning Human Understanding by David Hume (98),Unknown,Unknown,Unknown,Unknown,,https://www.gutenberg.org/ebooks/9662,,,
67138,The Sun Also Rises by Ernest Hemingway (98),"Hemingway, Ernest, 1899-1961","Jan 10, 2022",English,PS: Language and Literatures: American and Canadian literature,"Americans -- France -- Fiction, Americans -- Spain -- Fiction, Ashley, Brett (Fictitious character) -- Fiction, Expatriation -- Fiction, Spain -- History -- Alfonso XIII, 1886-1931 -- Fiction",https://www.gutenberg.org/ebooks/67138,The Sun Also Rises by Ernest Hemingway (98),"Jan 10, 2022","[('said', 963), ('brett', 391), ('âi', 375), ('bill', 325), ('went', 296), ('one', 240), ('mike', 211), ('like', 208), ('donât', 197), ('cohn', 194), ('get', 191), ('go', 191), ('came', 188), ('going', 183), ('would', 179), ('know', 174), ('back', 172), ('âyou', 161), ('got', 160), ('good', 159), ('see', 153), ('asked', 147), ('looked', 136), ('us', 131), ('could', 128), ('people', 122), ('think', 114), ('come', 111), ('two', 107), ('want', 106)]"
27673,Oedipus King of Thebes by Sophocles (98),"Sophocles, 495? BCE-406 BCE","Dec 31, 2008",English,PA: Language and Literatures: Classical Languages and Literature,"Tragedies, Oedipus (Greek mythological figure) -- Drama",https://www.gutenberg.org/ebooks/27673,,,
27761,"Hamlet, Prince of Denmark by William Shakespeare (98)","Shakespeare, William, 1564-1616","Jan 10, 2009",English,PR: Language and Literatures: English literature,"Tragedies, Hamlet (Legendary character) -- Drama, Kings and rulers -- Succession -- Drama, Murder victims' families -- Drama, Fathers -- Death -- Drama, Revenge -- Drama, Princes -- Drama, Denmark -- Drama",https://www.gutenberg.org/ebooks/27761,"Hamlet, Prince of Denmark by William Shakespeare (98)","Jan 10, 2009","[('footnote', 480), ('_ham_', 280), ('lord', 154), ('_ie_', 136), ('hamlet', 109), ('shall', 107), ('project', 87), ('thy', 86), ('come', 81), ('thou', 81), ('may', 79), ('r', 77), ('good', 77), ('_hor_', 77), ('_king_', 76), ('king', 71), ('_pol_', 69), ('let', 67), ('well', 64), ('time', 64), ('would', 62), ('upon', 58), ('must', 58), ('c', 57), ('ill', 57), ('make', 56), ('_and_', 56), ('go', 56), ('gutenbergtm', 56), ('horatio', 55)]"
8578,The Grand Inquisitor by Fyodor Dostoyevsky (97),"Dostoyevsky, Fyodor, 1821-1881","Jul 1, 2005",English,"PG: Language and Literatures: Slavic (including Russian), Languages and Literature","Jesus Christ -- Fiction, Christian fiction",https://www.gutenberg.org/ebooks/8578,,,
72278,The warriors by Tom Purdom (95),"Purdom, Tom, 1936-","Dec 1, 2023",English,PS: Language and Literatures: American and Canadian literature,"Science fiction, Short stories, Soldiers -- Fiction, Battles -- Fiction, Nonviolence -- Fiction",https://www.gutenberg.org/ebooks/72278,The warriors by Tom Purdom (95),"Dec 1, 2023","[('macfarland', 38), ('men', 34), ('said', 32), ('crawford', 31), ('crowd', 30), ('line', 28), ('doctor', 28), ('bell', 26), ('could', 25), ('belderkan', 22), ('convoy', 20), ('one', 20), ('scientists', 19), ('man', 19), ('belderkans', 16), ('airport', 15), ('us', 14), ('would', 14), ('like', 14), ('two', 14), ('helicopter', 14), ('right', 13), ('good', 13), ('made', 12), ('umbana', 12), ('car', 11), ('front', 11), ('still', 11), ('didnt', 11), ('enemy', 11)]"
2781,Just So Stories by Rudyard Kipling (95),Unknown,Unknown,Unknown,Unknown,,https://www.gutenberg.org/ebooks/2781,Just So Stories by Rudyard Kipling (95),Unknown,"[('said', 510), ('little', 101), ('wild', 98), ('like', 88), ('project', 82), ('taffy', 80), ('âi', 76), ('cat', 74), ('went', 73), ('one', 71), ('tegumai', 67), ('man', 65), ('know', 61), ('till', 60), ('see', 60), ('never', 58), ('always', 57), ('back', 56), ('work', 56), ('gutenbergtm', 56), ('came', 54), ('make', 54), ('made', 52), ('best', 49), ('ever', 49), ('great', 48), ('cave', 48), ('would', 47), ('donât', 47), ('woman', 47)]"
921,De Profundis by Oscar Wilde (95),"Wilde, Oscar, 1854-1900","May 1, 1997",English,PR: Language and Literatures: English literature,"Wilde, Oscar, 1854-1900, Suffering, Grief, Imprisonment",https://www.gutenberg.org/ebooks/921,,,
11339,Aesop's Fables; a new translation by Aesop (95),"Aesop, 620? BCE-564? BCE","Feb 1, 2004",English,PA: Language and Literatures: Classical Languages and Literature,"Fables, Greek -- Translations into English",https://www.gutenberg.org/ebooks/11339,Aesop's Fables; a new translation by Aesop (95),"Feb 1, 2004","[('said', 290), ('one', 216), ('lion', 166), ('fox', 158), ('man', 133), ('ass', 133), ('wolf', 126), ('time', 107), ('came', 106), ('upon', 93), ('project', 87), ('would', 87), ('day', 84), ('work', 76), ('well', 75), ('went', 75), ('could', 71), ('dog', 70), ('away', 69), ('replied', 69), ('got', 68), ('like', 67), ('see', 66), ('come', 65), ('good', 61), ('much', 61), ('saw', 60), ('get', 59), ('make', 59), ('go', 58)]"
3420,A Vindication of the Rights of Woman by Mary Wollstonecraft (94),"Wollstonecraft, Mary, 1759-1797","Sep 1, 2002",English,"HQ: Social sciences: The family, Marriage, Sex and Gender","Feminism, Women's rights -- Great Britain, Women -- Education -- Great Britain, Women -- History -- 19th century",https://www.gutenberg.org/ebooks/3420,,,
34206,"The Thousand and One Nights, Vol. I. (94)",Unknown,"Nov 3, 2010",English,PJ: Language and Literatures: Oriental languages and literatures,"Fairy tales, Tales -- Arab countries",https://www.gutenberg.org/ebooks/34206,"The Thousand and One Nights, Vol. I. (94)","Nov 3, 2010","[('said', 1742), ('thou', 1272), ('thee', 1051), ('upon', 956), ('one', 805), ('thy', 746), ('note', 675), ('god', 522), ('hath', 510), ('king', 454), ('may', 439), ('two', 434), ('son', 422), ('man', 413), ('answered', 405), ('wezeer', 381), ('went', 374), ('took', 367), ('therefore', 359), ('us', 342), ('day', 332), ('would', 330), ('house', 330), ('came', 317), ('replied', 310), ('night', 297), ('words', 290), ('first', 285), ('found', 284), ('heard', 284)]"
1974,The Poetics of Aristotle by Aristotle (94),Unknown,Unknown,Unknown,Unknown,,https://www.gutenberg.org/ebooks/1974,,,
147,Common Sense by Thomas Paine (94),"Paine, Thomas, 1737-1809","Jul 1, 1994",English,E201: History: America: Revolution (1775-1783),"United States -- Politics and government -- 1775-1783, Political science -- Early works to 1800, Monarchy -- Early works to 1800",https://www.gutenberg.org/ebooks/147,,,
2527,The Sorrows of Young Werther by Johann Wolfgang von Goethe (93),"Goethe, Johann Wolfgang von, 1749-1832","Feb 1, 2001",English,"PT: Language and Literatures: Germanic, Scandinavian, and Icelandic literatures","Germany -- Social life and customs -- Fiction, Unrequited love -- Fiction, Young men -- Germany -- Fiction",https://www.gutenberg.org/ebooks/2527,,,
41360,The Elementary Forms of the Religious Life by Émile Durkheim (93),Unknown,Unknown,Unknown,Unknown,,https://www.gutenberg.org/ebooks/41360,,,
15474,"The Mahabharata of Krishna-Dwaipayana Vyasa, Volume 1 (92)",Unknown,Unknown,Unknown,Unknown,,https://www.gutenberg.org/ebooks/15474,"The Mahabharata of Krishna-Dwaipayana Vyasa, Volume 1 (92)",Unknown,"[('thou', 4765), ('king', 3721), ('one', 2675), ('said', 2634), ('son', 2551), ('thy', 2453), ('thee', 2236), ('great', 2155), ('unto', 2102), ('also', 2051), ('like', 1686), ('men', 1401), ('hath', 1340), ('shall', 1170), ('thus', 1111), ('even', 1098), ('words', 1038), ('sons', 1011), ('âo', 1005), ('mighty', 977), ('upon', 974), ('race', 963), ('earth', 939), ('therefore', 912), ('art', 896), ('brahmanas', 891), ('gods', 881), ('lord', 879), ('yudhishthira', 845), ('continued', 832)]"
21765,"The Metamorphoses of Ovid, Books I-VII by Ovid (91)","Ovid, 43 BCE-18?","Jun 8, 2007",English,PA: Language and Literatures: Classical Languages and Literature,"Classical literature, Latin poetry -- Translations into English, Fables, Latin -- Translations into English, Metamorphosis -- Mythology -- Poetry, Mythology, Classical -- Poetry",https://www.gutenberg.org/ebooks/21765,"The Metamorphoses of Ovid, Books I-VII by Ovid (91)","Jun 8, 2007","[('footnote', 742), ('thou', 323), ('one', 314), ('name', 280), ('upon', 270), ('said', 239), ('son', 229), ('daughter', 205), ('thy', 197), ('called', 190), ('says', 189), ('earth', 182), ('jupiter', 182), ('may', 163), ('time', 161), ('father', 156), ('thus', 156), ('story', 152), ('thee', 151), ('sea', 145), ('great', 138), ('mother', 137), ('us', 134), ('first', 133), ('yet', 132), ('gods', 129), ('made', 127), ('two', 126), ('changed', 125), ('still', 120)]"
1,The Declaration of Independence of the United States of America by Thomas Jefferson (91),"Jefferson, Thomas, 1743-1826","Dec 1, 1971",English,E201: History: America: Revolution (1775-1783),"United States -- History -- Revolution, 1775-1783 -- Sources, United States. Declaration of Independence",https://www.gutenberg.org/ebooks/1,,,
110,Tess of the d'Urbervilles: A Pure Woman by Thomas Hardy (91),Unknown,Unknown,Unknown,Unknown,,https://www.gutenberg.org/ebooks/110,Tess of the d'Urbervilles: A Pure Woman by Thomas Hardy (91),Unknown,"[('tess', 713), ('said', 587), ('would', 509), ('could', 464), ('one', 462), ('âi', 350), ('upon', 342), ('like', 300), ('clare', 280), ('time', 239), ('come', 227), ('little', 207), ('never', 206), ('might', 204), ('man', 201), ('though', 200), ('know', 194), ('donât', 193), ('till', 191), ('came', 183), ('two', 180), ('day', 179), ('see', 176), ('think', 174), ('angel', 174), ('well', 171), ('thought', 171), ('old', 168), ('face', 167), ('went', 162)]"
159,The island of Doctor Moreau by H. G.  Wells (91),Unknown,Unknown,Unknown,Unknown,,https://www.gutenberg.org/ebooks/159,,,
816,Democracy in America — Volume 2 by Alexis de Tocqueville (90),"Tocqueville, Alexis de, 1805-1859","Jan 21, 2006",English,JK: Political science: Political inst. and pub. Admin.: United States,"United States -- Politics and government, United States -- Social conditions, Democracy -- United States",https://www.gutenberg.org/ebooks/816,,,
72281,Memoirs of William Wordsworth by George S.  Phillips (90),"Phillips, George S. (George Searle), 1815-1889","Dec 2, 2023",English,PR: Language and Literatures: English literature,"Poets, English -- 19th century -- Biography, Wordsworth, William, 1770-1850",https://www.gutenberg.org/ebooks/72281,Memoirs of William Wordsworth by George S.  Phillips (90),"Dec 2, 2023","[('wordsworth', 305), ('upon', 175), ('poet', 165), ('one', 141), ('time', 116), ('man', 107), ('life', 106), ('could', 94), ('âthe', 94), ('coleridge', 94), ('however', 89), ('like', 89), ('de', 83), ('first', 81), ('says', 80), ('little', 79), ('old', 78), ('wordsworthâs', 75), ('quincy', 74), ('nature', 73), ('would', 73), ('poem', 71), ('may', 69), ('mind', 67), ('great', 64), ('much', 62), ('poems', 60), ('even', 60), ('two', 59), ('beautiful', 57)]"
16119,Doctrina Christiana (90),Unknown,"Jun 23, 2005",English,"PL: Language and Literatures: Languages and literatures of Eastern Asia, Africa, Oceania","Tagalog language -- Texts, Catholic Church -- Catechisms -- Tagalog, Catholic Church -- Catechisms -- Spanish, Block books -- Facsimiles",https://www.gutenberg.org/ebooks/16119,,,
19322,The Antichrist by Friedrich Wilhelm Nietzsche (90),Unknown,Unknown,Unknown,Unknown,,https://www.gutenberg.org/ebooks/19322,,,
25141,The Pursuit of God by A. W.  Tozer (89),"Tozer, A. W. (Aiden Wilson), 1897-1963","Apr 23, 2008",English,"BV: Philosophy, Psychology, Religion: Christianity: Practical theology, Worship","God (Christianity) -- Worship and love, Spirituality",https://www.gutenberg.org/ebooks/25141,,,
40986,"The Oera Linda Book, from a Manuscript of the Thirteenth Century (89)",Unknown,"Oct 8, 2012",English,PF: Language and Literatures: West Germanic,Frisian language -- Texts,https://www.gutenberg.org/ebooks/40986,,,
8117,The Possessed (The Devils) by Fyodor Dostoyevsky (89),Unknown,Unknown,Unknown,Unknown,,https://www.gutenberg.org/ebooks/8117,,,
10625,A Concise Dictionary of Middle English from A.D. 1150 to 1580 by A. L.  Mayhew and Walter W.  Skeat (88),"Mayhew, A. L. (Anthony Lawson), 1842-1916","Jan 1, 2004",English,PE: Language and Literatures: English,"English language -- Middle English, 1100-1500 -- Dictionaries",https://www.gutenberg.org/ebooks/10625,A Concise Dictionary of Middle English from A.D. 1150 to 1580 by A. L.  Mayhew and Walter W.  Skeat (88),"Jan 1, 2004","[('s2', 5406), ('_sb_', 5181), ('see', 4162), ('pp', 3805), ('_v_', 2506), ('md', 2444), ('s3', 2218), ('lat', 1796), ('c2', 1681), ('s_', 1385), ('_adj_', 1384), ('_pl_', 1357), ('prompt', 1200), ('w', 1124), ('_pt', 1107), ('_pp_', 1103), ('c', 1099), ('c3', 1044), ('cp', 980), ('hd', 938), ('h', 920), ('p', 916), ('sâas', 837), ('_adv_', 707), ('w2', 647), ('voc', 630), ('pl_', 543), ('g', 516), ('_pr', 511), ('skd', 481)]"
834,The Memoirs of Sherlock Holmes by Arthur Conan Doyle (88),Unknown,Unknown,Unknown,Unknown,,https://www.gutenberg.org/ebooks/834,,,
16966,"Shakespearean Tragedy: Lectures on Hamlet, Othello, King Lear, Macbeth by A. C.  Bradley (87)","Bradley, A. C. (Andrew Cecil), 1851-1935","Oct 30, 2005",English,PR: Language and Literatures: English literature,"Shakespeare, William, 1564-1616 -- Tragedies",https://www.gutenberg.org/ebooks/16966,,,
61262,Poirot Investigates by Agatha Christie (87),"Christie, Agatha, 1890-1976","Jan 28, 2020",English,PR: Language and Literatures: English literature,"Private investigators -- England -- Fiction, Detective and mystery stories, English, Belgians -- England -- Fiction, Poirot, Hercule (Fictitious character) -- Fiction",https://www.gutenberg.org/ebooks/61262,Poirot Investigates by Agatha Christie (87),"Jan 28, 2020","[('poirot', 451), ('said', 205), ('one', 196), ('âi', 172), ('mr', 159), ('man', 147), ('would', 119), ('little', 116), ('us', 114), ('must', 106), ('see', 102), ('âyou', 95), ('â', 94), ('project', 90), ('friend', 89), ('know', 83), ('mrs', 82), ('door', 77), ('time', 76), ('two', 75), ('hastings', 71), ('âbut', 71), ('could', 70), ('work', 69), ('head', 68), ('left', 66), ('may', 62), ('âthe', 62), ('way', 62), ('âand', 60)]"
9105,Reflections; or Sentences and Moral Maxims by François duc de La Rochefoucauld (87),"La Rochefoucauld, François duc de, 1613-1680","Oct 1, 2005",English,"PQ: Language and Literatures: Romance literatures: French, Italian, Spanish, Portuguese",Maxims,https://www.gutenberg.org/ebooks/9105,,,
45631,Twelve Years a Slave by Solomon Northup (87),"Northup, Solomon, 1808-1863?","May 11, 2014",English,E300: History: America: Revolution to the Civil War (1783-1861),"African Americans -- Biography, Enslaved persons -- United States -- Biography, Enslaved persons' writings, American, Northup, Solomon, 1808-1863?, Plantation life -- Louisiana -- History -- 19th century, Slavery -- Louisiana -- History -- 19th century",https://www.gutenberg.org/ebooks/45631,,,
