Book ID,Title_x,Author,Publication Date,Language,LoC Class,Subjects,Link,Title_y,Date,Most Common Words
84,"Frankenstein; Or, The Modern Prometheus by Mary Wollstonecraft Shelley (2310)","Shelley, Mary Wollstonecraft, 1797-1851","Oct 1, 1993",English,PR: Language and Literatures: English literature,"Science fiction, Horror tales, Gothic fiction, Scientists -- Fiction, Monsters -- Fiction, Frankenstein, Victor (Fictitious character) -- Fiction, Frankenstein's monster (Fictitious character) -- Fiction",https://www.gutenberg.org/ebooks/84,"Frankenstein; Or, The Modern Prometheus by Mary Wollstonecraft Shelley (2310)","Oct 1, 1993","[('one', 199), ('could', 197), ('would', 183), ('yet', 149), ('man', 129), ('upon', 128), ('may', 113), ('life', 112), ('first', 108), ('might', 108), ('father', 108), ('every', 106), ('shall', 105), ('eyes', 104), ('said', 102), ('time', 97), ('even', 96), ('towards', 94), ('saw', 94), ('found', 89), ('project', 88), ('mind', 85), ('night', 84), ('elizabeth', 81), ('day', 80), ('felt', 79), ('ever', 78), ('work', 78), ('heart', 76), ('feelings', 76)]"
2701,"Moby Dick; Or, The Whale by Herman Melville (2175)","Melville, Herman, 1819-1891","Jul 1, 2001",English,PS: Language and Literatures: American and Canadian literature,"Whaling -- Fiction, Sea stories, Psychological fiction, Ship captains -- Fiction, Adventure stories, Mentally ill -- Fiction, Ahab, Captain (Fictitious character) -- Fiction, Whales -- Fiction, Whaling ships -- Fiction",https://www.gutenberg.org/ebooks/2701,"Moby Dick; Or, The Whale by Herman Melville (2175)","Jul 1, 2001","[('whale', 917), ('one', 884), ('like', 571), ('upon', 564), ('old', 441), ('would', 427), ('man', 413), ('ahab', 404), ('ye', 395), ('ship', 372), ('sea', 367), ('though', 360), ('yet', 335), ('time', 319), ('long', 310), ('chapter', 308), ('still', 307), ('great', 304), ('said', 294), ('must', 291), ('seemed', 281), ('captain', 280), ('two', 279), ('last', 272), ('whales', 263), ('head', 263), ('see', 253), ('way', 248), ('white', 248), ('little', 248)]"
1342,Pride and Prejudice by Jane Austen (1966),"Austen, Jane, 1775-1817","Jun 1, 1998",English,PR: Language and Literatures: English literature,"England -- Fiction, Young women -- Fiction, Love stories, Sisters -- Fiction, Domestic fiction, Courtship -- Fiction, Social classes -- Fiction",https://www.gutenberg.org/ebooks/1342,Pride and Prejudice by Jane Austen (1966),"Jun 1, 1998","[('mr', 790), ('elizabeth', 598), ('could', 528), ('would', 478), ('said', 405), ('darcy', 356), ('mrs', 348), ('much', 328), ('must', 320), ('miss', 304), ('âi', 300), ('bennet', 290), ('one', 274), ('jane', 263), ('bingley', 246), ('know', 235), ('though', 228), ('never', 227), ('think', 216), ('soon', 213), ('may', 210), ('might', 203), ('time', 198), ('little', 187), ('well', 186), ('every', 185), ('without', 181), ('nothing', 180), ('lady', 179), ('make', 172)]"
46,A Christmas Carol in Prose; Being a Ghost Story of Christmas by Charles Dickens (1914),Unknown,Unknown,Unknown,Unknown,,https://www.gutenberg.org/ebooks/46,A Christmas Carol in Prose; Being a Ghost Story of Christmas by Charles Dickens (1914),Unknown,"[('scrooge', 314), ('said', 221), ('upon', 120), ('one', 109), ('ghost', 93), ('christmas', 91), ('project', 88), ('would', 84), ('spirit', 84), ('old', 69), ('man', 68), ('time', 65), ('little', 63), ('good', 63), ('know', 61), ('could', 61), ('like', 59), ('work', 56), ('gutenbergtm', 56), ('cried', 52), ('see', 50), ('bob', 49), ('scrooges', 48), ('came', 45), ('went', 44), ('hand', 43), ('made', 43), ('dont', 42), ('door', 41), ('might', 40)]"
145,Middlemarch by George Eliot (1816),"Eliot, George, 1819-1880","Jul 1, 1994",English,PR: Language and Literatures: English literature,"Didactic fiction, City and town life -- Fiction, England -- Fiction, Young women -- Fiction, Love stories, Domestic fiction, Married people -- Fiction, Bildungsromans",https://www.gutenberg.org/ebooks/145,Middlemarch by George Eliot (1816),"Jul 1, 1994","[('said', 2222), ('mr', 1928), ('would', 1512), ('âi', 918), ('could', 836), ('lydgate', 835), ('dorothea', 784), ('one', 781), ('mrs', 689), ('might', 645), ('like', 644), ('little', 614), ('man', 601), ('know', 578), ('must', 572), ('never', 534), ('much', 521), ('think', 520), ('good', 511), ('made', 504), ('casaubon', 492), ('say', 484), ('see', 478), ('bulstrode', 466), ('rosamond', 460), ('fred', 457), ('go', 422), ('thought', 403), ('come', 403), ('make', 400)]"
2641,A Room with a View by E. M.  Forster (1727),"Forster, E. M. (Edward Morgan), 1879-1970","May 1, 2001",English,PR: Language and Literatures: English literature,"Humorous stories, England -- Fiction, Young women -- Fiction, British -- Italy -- Fiction, Florence (Italy) -- Fiction",https://www.gutenberg.org/ebooks/2641,A Room with a View by E. M.  Forster (1727),"May 1, 2001","[('said', 427), ('miss', 407), ('lucy', 397), ('mr', 379), ('âi', 308), ('would', 266), ('one', 226), ('cecil', 209), ('bartlett', 184), ('beebe', 181), ('must', 145), ('honeychurch', 138), ('go', 136), ('like', 132), ('could', 132), ('never', 128), ('know', 128), ('george', 124), ('little', 119), ('people', 113), ('donât', 113), ('freddy', 112), ('see', 109), ('mrs', 108), ('man', 107), ('say', 103), ('emerson', 101), ('âoh', 100), ('much', 95), ('mother', 92)]"
1513,Romeo and Juliet by William Shakespeare (1727),"Shakespeare, William, 1564-1616","Nov 1, 1998",English,PR: Language and Literatures: English literature,"Vendetta -- Drama, Youth -- Drama, Verona (Italy) -- Drama, Juliet (Fictitious character) -- Drama, Romeo (Fictitious character) -- Drama, Conflict of generations -- Drama, Tragedies",https://www.gutenberg.org/ebooks/1513,Romeo and Juliet by William Shakespeare (1727),"Nov 1, 1998","[('romeo', 300), ('thou', 277), ('juliet', 180), ('thy', 170), ('capulet', 141), ('nurse', 140), ('love', 136), ('thee', 135), ('shall', 112), ('lady', 109), ('friar', 103), ('come', 95), ('project', 84), ('mercutio', 83), ('good', 80), ('benvolio', 77), ('enter', 75), ('go', 75), ('iâll', 71), ('tybalt', 69), ('death', 69), ('night', 68), ('lawrence', 66), ('man', 65), ('hath', 64), ('may', 63), ('gutenbergâ', 61), ('one', 60), ('well', 58), ('paris', 57)]"
37106,"Little Women; Or, Meg, Jo, Beth, and Amy by Louisa May Alcott (1605)","Alcott, Louisa May, 1832-1888","Aug 16, 2011",English,PZ: Language and Literatures: Juvenile belles lettres,"Autobiographical fiction, Young women -- Fiction, Sisters -- Fiction, Domestic fiction, Family life -- New England -- Fiction, New England -- Fiction, Bildungsromans, Mothers and daughters -- Fiction, March family (Fictitious characters) -- Fiction",https://www.gutenberg.org/ebooks/37106,,,
100,The Complete Works of William Shakespeare by William Shakespeare (1589),Unknown,Unknown,Unknown,Unknown,,https://www.gutenberg.org/ebooks/100,The Complete Works of William Shakespeare by William Shakespeare (1589),Unknown,"[('thou', 5831), ('thy', 4348), ('shall', 3835), ('thee', 3395), ('lord', 3082), ('king', 2993), ('sir', 2950), ('good', 2941), ('come', 2611), ('would', 2474), ('enter', 2406), ('well', 2270), ('love', 2267), ('let', 2213), ('hath', 2056), ('one', 1943), ('like', 1936), ('man', 1899), ('iâll', 1885), ('upon', 1863), ('may', 1804), ('make', 1787), ('go', 1782), ('know', 1749), ('us', 1747), ('say', 1738), ('yet', 1729), ('must', 1647), ('scene', 1631), ('see', 1548)]"
16389,The Enchanted April by Elizabeth Von Arnim (1527),"Von Arnim, Elizabeth, 1866-1941","Jul 29, 2005",English,PR: Language and Literatures: English literature,"Love stories, Domestic fiction, Italy -- Fiction, Female friendship -- Fiction, British -- Italy -- Fiction",https://www.gutenberg.org/ebooks/16389,The Enchanted April by Elizabeth Von Arnim (1527),"Jul 29, 2005","[('mrs', 957), ('said', 532), ('would', 517), ('wilkins', 449), ('one', 406), ('fisher', 368), ('could', 297), ('mr', 237), ('arbuthnot', 237), ('lady', 223), ('thought', 178), ('like', 175), ('caroline', 173), ('scrap', 165), ('much', 156), ('rose', 148), ('come', 134), ('even', 131), ('âi', 129), ('go', 126), ('see', 124), ('briggs', 124), ('lotty', 122), ('got', 121), ('time', 120), ('little', 120), ('quite', 119), ('away', 111), ('nothing', 110), ('seemed', 108)]"
67979,The Blue Castle: a novel by L. M.  Montgomery (1526),"Montgomery, L. M. (Lucy Maud), 1874-1942","May 3, 2022",English,PZ: Language and Literatures: Juvenile belles lettres,"Self-actualization (Psychology) -- Fiction, Single women -- Fiction, Choice -- Fiction, Canada -- History -- 1914-1945 -- Fiction, Romance fiction, Love -- Fiction, Young adult fiction",https://www.gutenberg.org/ebooks/67979,The Blue Castle: a novel by L. M.  Montgomery (1526),"May 3, 2022","[('valancy', 920), ('said', 459), ('would', 309), ('barney', 295), ('one', 251), ('never', 236), ('little', 230), ('uncle', 221), ('could', 213), ('cousin', 211), ('like', 204), ('old', 185), ('âi', 159), ('thought', 151), ('mrs', 141), ('always', 134), ('frederick', 127), ('went', 126), ('go', 120), ('dr', 119), ('back', 119), ('know', 115), ('come', 114), ('donât', 113), ('must', 110), ('benjamin', 109), ('stickles', 104), ('abel', 98), ('even', 97), ('ever', 97)]"
394,Cranford by Elizabeth Cleghorn Gaskell (1451),"Gaskell, Elizabeth Cleghorn, 1810-1865","Jan 1, 1996",English,PR: Language and Literatures: English literature,"England -- Fiction, Sisters -- Fiction, Pastoral fiction, Villages -- Fiction, Older women -- Fiction, Female friendship -- Fiction",https://www.gutenberg.org/ebooks/394,Cranford by Elizabeth Cleghorn Gaskell (1451),"Jan 1, 1996","[('miss', 857), ('matty', 341), ('would', 301), ('could', 289), ('said', 284), ('mrs', 258), ('little', 217), ('one', 217), ('pole', 188), ('cranford', 177), ('mr', 155), ('think', 150), ('us', 146), ('came', 146), ('time', 141), ('much', 136), ('never', 135), ('thought', 126), ('might', 124), ('made', 121), ('jenkyns', 121), ('lady', 120), ('like', 120), ('know', 117), ('see', 116), ('father', 111), ('dear', 104), ('old', 103), ('jamieson', 103), ('poor', 101)]"
6761,The Adventures of Ferdinand Count Fathom — Complete by T.  Smollett (1439),"Smollett, T. (Tobias), 1721-1771","Sep 9, 2004",English,PR: Language and Literatures: English literature,"Gothic fiction, Adventure stories",https://www.gutenberg.org/ebooks/6761,The Adventures of Ferdinand Count Fathom — Complete by T.  Smollett (1439),"Sep 9, 2004","[('upon', 782), ('would', 558), ('could', 406), ('fathom', 330), ('without', 287), ('one', 265), ('might', 239), ('made', 231), ('count', 219), ('though', 218), ('young', 217), ('time', 212), ('person', 203), ('great', 195), ('every', 193), ('whose', 188), ('heart', 186), ('found', 178), ('life', 176), ('renaldo', 169), ('good', 166), ('adventurer', 162), ('never', 160), ('house', 151), ('honour', 145), ('much', 139), ('chapter', 137), ('even', 137), ('lady', 136), ('said', 136)]"
2160,The Expedition of Humphry Clinker by T.  Smollett (1405),Unknown,Unknown,Unknown,Unknown,,https://www.gutenberg.org/ebooks/2160,The Expedition of Humphry Clinker by T.  Smollett (1405),Unknown,"[('upon', 463), ('would', 445), ('one', 343), ('without', 304), ('mr', 280), ('said', 278), ('great', 251), ('could', 247), ('good', 235), ('much', 235), ('may', 232), ('made', 227), ('shall', 221), ('every', 212), ('time', 210), ('make', 189), ('must', 183), ('know', 180), ('even', 177), ('well', 171), ('man', 170), ('uncle', 169), ('house', 167), ('mrs', 167), ('like', 162), ('poor', 161), ('dear', 155), ('us', 151), ('little', 148), ('place', 147)]"
4085,The Adventures of Roderick Random by T.  Smollett (1396),"Smollett, T. (Tobias), 1721-1771","May 1, 2003",English,PR: Language and Literatures: English literature,"Sea stories, England -- Fiction, Picaresque literature, Rogues and vagabonds -- Fiction, Sailors -- Fiction, Warships -- Fiction, Scots -- England -- Fiction, Impressment -- Fiction",https://www.gutenberg.org/ebooks/4085,The Adventures of Roderick Random by T.  Smollett (1396),"May 1, 2003","[('would', 690), ('upon', 656), ('could', 576), ('one', 436), ('time', 426), ('great', 406), ('much', 396), ('us', 340), ('made', 322), ('without', 317), ('said', 316), ('good', 315), ('mr', 264), ('might', 246), ('told', 242), ('well', 233), ('found', 229), ('day', 217), ('man', 211), ('went', 210), ('know', 206), ('captain', 194), ('put', 187), ('strap', 182), ('little', 180), ('must', 172), ('two', 171), ('took', 170), ('make', 169), ('old', 166)]"
6593,"History of Tom Jones, a Foundling by Henry Fielding (1374)",Unknown,Unknown,Unknown,Unknown,,https://www.gutenberg.org/ebooks/6593,"History of Tom Jones, a Foundling by Henry Fielding (1374)",Unknown,"[('jones', 1607), ('would', 1294), ('mr', 1211), ('said', 943), ('one', 929), ('sophia', 876), ('much', 812), ('may', 787), ('indeed', 760), ('upon', 702), ('could', 697), ('âi', 685), ('lady', 679), ('man', 668), ('good', 659), ('mrs', 650), ('never', 649), ('great', 648), ('little', 648), ('though', 636), ('hath', 631), ('must', 595), ('well', 591), ('allworthy', 582), ('answered', 565), ('chapter', 514), ('time', 513), ('shall', 503), ('cries', 492), ('young', 487)]"
1259,Twenty years after by Alexandre Dumas and Auguste Maquet (1329),"Dumas, Alexandre, 1802-1870","Mar 1, 1998",English,"PQ: Language and Literatures: Romance literatures: French, Italian, Spanish, Portuguese","France -- History -- Louis XIV, 1643-1715 -- Fiction",https://www.gutenberg.org/ebooks/1259,Twenty years after by Alexandre Dumas and Auguste Maquet (1329),"Mar 1, 1998","[('said', 2374), ('dâartagnan', 1512), ('de', 967), ('athos', 961), ('âi', 921), ('one', 898), ('porthos', 769), ('man', 652), ('aramis', 630), ('monsieur', 580), ('us', 527), ('mazarin', 515), ('two', 508), ('âand', 500), ('would', 488), ('queen', 486), ('king', 457), ('âyou', 445), ('shall', 441), ('cried', 434), ('replied', 431), ('know', 429), ('asked', 371), ('see', 369), ('time', 362), ('must', 330), ('la', 329), ('cardinal', 315), ('made', 309), ('âyes', 307)]"
5197,My Life — Volume 1 by Richard Wagner (1323),Unknown,Unknown,Unknown,Unknown,,https://www.gutenberg.org/ebooks/5197,My Life — Volume 1 by Richard Wagner (1323),Unknown,"[('time', 693), ('one', 586), ('could', 574), ('would', 456), ('first', 452), ('made', 440), ('work', 430), ('great', 418), ('upon', 365), ('dresden', 354), ('also', 318), ('opera', 310), ('even', 299), ('us', 288), ('theatre', 279), ('way', 276), ('much', 275), ('seemed', 273), ('found', 254), ('man', 252), ('day', 242), ('part', 240), ('life', 236), ('paris', 235), ('however', 235), ('last', 223), ('quite', 219), ('thought', 219), ('without', 210), ('performance', 208)]"
11,Alice's Adventures in Wonderland by Lewis Carroll (1016),Unknown,Unknown,Unknown,Unknown,,https://www.gutenberg.org/ebooks/11,,,
25344,The Scarlet Letter by Nathaniel Hawthorne (945),Unknown,Unknown,Unknown,Unknown,,https://www.gutenberg.org/ebooks/25344,The Scarlet Letter by Nathaniel Hawthorne (945),Unknown,"[('hester', 343), ('would', 278), ('little', 234), ('one', 230), ('old', 213), ('thou', 206), ('pearl', 189), ('might', 183), ('could', 182), ('upon', 177), ('man', 167), ('child', 159), ('minister', 151), ('life', 147), ('said', 147), ('prynne', 136), ('letter', 131), ('may', 130), ('scarlet', 123), ('mr', 121), ('heart', 117), ('like', 116), ('good', 115), ('yet', 114), ('mother', 112), ('hand', 107), ('must', 107), ('made', 106), ('never', 99), ('long', 99)]"
72297,Cobra by Martin Brown and Russell Holman (774),"Brown, Martin","Dec 3, 2023",English,Unknown,,https://www.gutenberg.org/ebooks/72297,Cobra by Martin Brown and Russell Holman (774),"Dec 3, 2023","[('rodrigo', 667), ('john', 480), ('dorning', 252), ('said', 211), ('would', 207), ('upon', 179), ('mary', 169), ('man', 148), ('elise', 121), ('little', 112), ('know', 111), ('well', 108), ('back', 107), ('could', 105), ('sophie', 105), ('one', 103), ('time', 101), ('like', 100), ('business', 100), ('love', 100), ('eyes', 94), ('made', 92), ('dont', 92), ('see', 85), ('go', 85), ('new', 82), ('two', 81), ('voice', 79), ('old', 77), ('face', 75)]"
2542,A Doll's House : a play by Henrik Ibsen (761),"Ibsen, Henrik, 1828-1906","Mar 1, 2001",English,"PT: Language and Literatures: Germanic, Scandinavian, and Icelandic literatures","Marriage -- Drama, Man-woman relationships -- Drama, Norwegian drama -- Translations into English, Wives -- Drama",https://www.gutenberg.org/ebooks/2542,,,
174,The Picture of Dorian Gray by Oscar Wilde (729),"Wilde, Oscar, 1854-1900","Oct 1, 1994",English,PR: Language and Literatures: English literature,"Didactic fiction, Supernatural -- Fiction, Conduct of life -- Fiction, Portraits -- Fiction, Great Britain -- History -- Victoria, 1837-1901 -- Fiction, London (England) -- History -- 1800-1950 -- Fiction, Appearance (Philosophy) -- Fiction, Paranormal fiction",https://www.gutenberg.org/ebooks/174,The Picture of Dorian Gray by Oscar Wilde (729),"Oct 1, 1994","[('one', 368), ('dorian', 352), ('would', 303), ('âi', 289), ('said', 260), ('lord', 245), ('donât', 232), ('henry', 217), ('life', 213), ('like', 207), ('gray', 168), ('man', 167), ('know', 167), ('never', 166), ('must', 163), ('could', 136), ('âyou', 126), ('things', 125), ('see', 123), ('think', 121), ('us', 121), ('thing', 118), ('seemed', 118), ('basil', 118), ('something', 116), ('come', 116), ('go', 111), ('made', 108), ('eyes', 107), ('always', 107)]"
844,The Importance of Being Earnest: A Trivial Comedy for Serious People by Oscar Wilde (684),Unknown,Unknown,Unknown,Unknown,,https://www.gutenberg.org/ebooks/844,The Importance of Being Earnest: A Trivial Comedy for Serious People by Oscar Wilde (684),Unknown,"[('jack', 285), ('algernon', 268), ('cecily', 254), ('gwendolen', 176), ('lady', 139), ('miss', 135), ('bracknell', 125), ('one', 114), ('project', 88), ('mr', 86), ('prism', 84), ('ernest', 80), ('donât', 77), ('quite', 68), ('yes', 66), ('would', 66), ('dear', 64), ('well', 64), ('chasuble', 63), ('think', 62), ('worthing', 61), ('oh', 59), ('may', 58), ('know', 56), ('never', 56), ('name', 56), ('gutenbergtm', 56), ('work', 52), ('brother', 51), ('like', 48)]"
345,Dracula by Bram Stoker (683),"Stoker, Bram, 1847-1912","Oct 1, 1995",English,PR: Language and Literatures: English literature,"Horror tales, Epistolary fiction, Gothic fiction, Vampires -- Fiction, Dracula, Count (Fictitious character) -- Fiction, Transylvania (Romania) -- Fiction, Whitby (England) -- Fiction",https://www.gutenberg.org/ebooks/345,,,
33283,Calculus Made Easy by Silvanus P.  Thompson (674),"Thompson, Silvanus P. (Silvanus Phillips), 1851-1916","Jul 28, 2010",English,QA: Science: Mathematics,Calculus,https://www.gutenberg.org/ebooks/33283,,,
64317,The Great Gatsby by F. Scott  Fitzgerald (646),Unknown,Unknown,Unknown,Unknown,,https://www.gutenberg.org/ebooks/64317,The Great Gatsby by F. Scott  Fitzgerald (646),Unknown,"[('said', 233), ('âi', 177), ('gatsby', 176), ('tom', 164), ('daisy', 137), ('one', 136), ('like', 116), ('came', 108), ('back', 105), ('little', 102), ('project', 90), ('went', 90), ('man', 86), ('house', 85), ('eyes', 85), ('know', 84), ('got', 83), ('looked', 82), ('didnât', 81), ('old', 79), ('mr', 78), ('donât', 73), ('new', 72), ('time', 72), ('way', 71), ('get', 71), ('moment', 70), ('us', 70), ('two', 69), ('see', 68)]"
5200,Metamorphosis by Franz Kafka (638),"Kafka, Franz, 1883-1924","Aug 17, 2005",English,"PT: Language and Literatures: Germanic, Scandinavian, and Icelandic literatures","Psychological fiction, Metamorphosis -- Fiction",https://www.gutenberg.org/ebooks/5200,Metamorphosis by Franz Kafka (638),"Aug 17, 2005","[('gregor', 188), ('would', 185), ('room', 129), ('could', 119), ('gregorâs', 99), ('sister', 96), ('father', 95), ('project', 90), ('door', 85), ('back', 82), ('even', 82), ('mother', 77), ('work', 74), ('way', 63), ('one', 59), ('time', 58), ('gutenbergtm', 56), ('little', 49), ('said', 49), ('without', 47), ('still', 44), ('first', 44), ('get', 43), ('see', 41), ('made', 40), ('much', 39), ('go', 39), ('head', 38), ('chief', 37), ('like', 36)]"
98,A Tale of Two Cities by Charles Dickens (611),"Dickens, Charles, 1812-1870","Jan 1, 1994",English,PR: Language and Literatures: English literature,"Historical fiction, France -- History -- Revolution, 1789-1799 -- Fiction, London (England) -- History -- 18th century -- Fiction, War stories, Executions and executioners -- Fiction, French -- England -- London -- Fiction, Lookalikes -- Fiction, British -- France -- Paris -- Fiction, Paris (France) -- History -- 1789-1799 -- Fiction",https://www.gutenberg.org/ebooks/98,A Tale of Two Cities by Charles Dickens (611),"Jan 1, 1994","[('said', 659), ('mr', 606), ('one', 418), ('âi', 409), ('would', 335), ('lorry', 322), ('upon', 288), ('could', 281), ('defarge', 268), ('man', 264), ('little', 263), ('time', 247), ('hand', 241), ('miss', 213), ('know', 212), ('two', 210), ('looked', 193), ('like', 192), ('made', 185), ('long', 183), ('face', 182), ('old', 181), ('never', 180), ('way', 178), ('madame', 178), ('good', 176), ('see', 175), ('much', 172), ('night', 170), ('head', 170)]"
1400,Great Expectations by Charles Dickens (570),"Dickens, Charles, 1812-1870","Jul 1, 1998",English,PR: Language and Literatures: English literature,"Orphans -- Fiction, England -- Fiction, Revenge -- Fiction, Bildungsromans, Young men -- Fiction, Man-woman relationships -- Fiction, Ex-convicts -- Fiction, Benefactors -- Fiction",https://www.gutenberg.org/ebooks/1400,,,
28054,The Brothers Karamazov by Fyodor Dostoyevsky (564),"Dostoyevsky, Fyodor, 1821-1881","Feb 12, 2009",English,"PG: Language and Literatures: Slavic (including Russian), Languages and Literature","Didactic fiction, Fathers and sons -- Fiction, Russia -- Social life and customs -- 1533-1917 -- Fiction, Brothers -- Fiction",https://www.gutenberg.org/ebooks/28054,The Brothers Karamazov by Fyodor Dostoyevsky (564),"Feb 12, 2009","[('one', 1486), ('alyosha', 1133), ('would', 1084), ('said', 987), ('though', 811), ('know', 810), ('man', 802), ('mitya', 786), ('come', 709), ('donât', 708), ('âi', 654), ('could', 654), ('ivan', 647), ('father', 644), ('time', 639), ('like', 639), ('even', 635), ('itâs', 631), ('see', 588), ('suddenly', 583), ('go', 572), ('say', 542), ('must', 521), ('tell', 497), ('old', 483), ('cried', 476), ('little', 468), ('thatâs', 460), ('love', 446), ('went', 446)]"
1080,A Modest Proposal by Jonathan Swift (557),"Swift, Jonathan, 1667-1745","Oct 1, 1997",English,PR: Language and Literatures: English literature,"Political satire, English, Religious satire, English, Ireland -- Politics and government -- 18th century -- Humor",https://www.gutenberg.org/ebooks/1080,A Modest Proposal by Jonathan Swift (557),"Oct 1, 1997","[('project', 89), ('gutenbergtm', 56), ('work', 51), ('works', 32), ('gutenberg', 31), ('electronic', 27), ('may', 26), ('terms', 22), ('foundation', 22), ('states', 20), ('children', 20), ('copyright', 19), ('would', 18), ('agreement', 18), ('license', 17), ('country', 17), ('one', 16), ('united', 15), ('kingdom', 15), ('upon', 15), ('thousand', 15), ('donations', 15), ('number', 14), ('full', 14), ('ebook', 13), ('use', 13), ('trademark', 13), ('literary', 13), ('archive', 13), ('copy', 12)]"
2554,Crime and Punishment by Fyodor Dostoyevsky (518),"Dostoyevsky, Fyodor, 1821-1881","Mar 28, 2006",English,"PG: Language and Literatures: Slavic (including Russian), Languages and Literature","Detective and mystery stories, Psychological fiction, Saint Petersburg (Russia) -- Fiction, Murder -- Fiction, Crime -- Psychological aspects -- Fiction",https://www.gutenberg.org/ebooks/2554,Crime and Punishment by Fyodor Dostoyevsky (518),"Mar 28, 2006","[('raskolnikov', 714), ('one', 588), ('would', 569), ('said', 516), ('know', 500), ('could', 488), ('like', 443), ('come', 432), ('though', 431), ('man', 431), ('âi', 427), ('donât', 423), ('itâs', 379), ('see', 370), ('time', 359), ('went', 354), ('even', 334), ('sonia', 332), ('go', 329), ('razumihin', 312), ('thought', 305), ('must', 298), ('looked', 293), ('suddenly', 291), ('something', 282), ('little', 281), ('dounia', 277), ('say', 276), ('last', 273), ('thatâs', 270)]"
2591,Grimms' Fairy Tales by Jacob Grimm and Wilhelm Grimm (503),"Grimm, Jacob, 1785-1863","Apr 1, 2001",English,"PT: Language and Literatures: Germanic, Scandinavian, and Icelandic literatures",Fairy tales -- Germany,https://www.gutenberg.org/ebooks/2591,Grimms' Fairy Tales by Jacob Grimm and Wilhelm Grimm (503),"Apr 1, 2001","[('said', 1160), ('came', 461), ('went', 445), ('little', 393), ('one', 385), ('âi', 287), ('away', 280), ('king', 266), ('could', 260), ('would', 259), ('go', 249), ('took', 244), ('man', 215), ('old', 205), ('upon', 196), ('time', 184), ('saw', 183), ('day', 181), ('must', 174), ('come', 171), ('home', 170), ('shall', 170), ('thought', 165), ('good', 160), ('soon', 157), ('cried', 153), ('take', 152), ('great', 152), ('back', 148), ('give', 147)]"
1661,The Adventures of Sherlock Holmes by Arthur Conan Doyle (489),"Doyle, Arthur Conan, 1859-1930","Mar 1, 1999",English,PR: Language and Literatures: English literature,"Holmes, Sherlock (Fictitious character) -- Fiction, Private investigators -- England -- Fiction, Detective and mystery stories, English",https://www.gutenberg.org/ebooks/1661,The Adventures of Sherlock Holmes by Arthur Conan Doyle (489),"Mar 1, 1999","[('said', 484), ('upon', 465), ('holmes', 413), ('âi', 369), ('one', 344), ('would', 324), ('could', 286), ('man', 280), ('little', 267), ('mr', 262), ('see', 216), ('may', 208), ('us', 182), ('must', 171), ('shall', 171), ('think', 168), ('know', 161), ('come', 148), ('came', 146), ('time', 144), ('âyou', 140), ('two', 139), ('âit', 137), ('door', 131), ('back', 131), ('face', 128), ('might', 125), ('room', 125), ('âand', 120), ('much', 116)]"
