Book ID,Title_x,Author,Publication Date,Language,LoC Class,Subjects,Link,Title_y,Date,Most Common Words
1321,The Waste Land by T. S.  Eliot (35),"Eliot, T. S. (Thomas Stearns), 1888-1965","May 1, 1998",English,PS: Language and Literatures: American and Canadian literature,"Poetry, Prose poems",https://www.gutenberg.org/ebooks/1321,The Waste Land by T. S.  Eliot (35),"May 1, 1998","[('project', 89), ('gutenbergtm', 56), ('work', 46), ('works', 33), ('gutenberg', 32), ('electronic', 27), ('v', 24), ('terms', 22), ('foundation', 22), ('states', 20), ('said', 20), ('cf', 20), ('copyright', 19), ('may', 18), ('water', 18), ('agreement', 18), ('license', 17), ('one', 17), ('united', 15), ('full', 15), ('donations', 15), ('ebook', 13), ('shall', 13), ('trademark', 13), ('literary', 13), ('archive', 13), ('use', 12), ('copy', 12), ('dead', 12), ('part', 12)]"
52521,Grimm's Fairy Tales by Jacob Grimm and Wilhelm Grimm (34),"Grimm, Jacob, 1785-1863","Jul 7, 2016",English,PZ: Language and Literatures: Juvenile belles lettres,"Fairy tales, Children's stories, German -- Translations into English, Fairy tales -- Germany",https://www.gutenberg.org/ebooks/52521,Grimm's Fairy Tales by Jacob Grimm and Wilhelm Grimm (34),"Jul 7, 2016","[('said', 911), ('little', 491), ('one', 407), ('went', 385), ('came', 359), ('king', 270), ('âi', 241), ('go', 237), ('old', 230), ('away', 221), ('man', 208), ('took', 207), ('saw', 193), ('could', 190), ('woman', 185), ('would', 175), ('time', 169), ('come', 162), ('shall', 159), ('home', 157), ('day', 156), ('back', 156), ('two', 148), ('kingâs', 143), ('thought', 139), ('good', 139), ('must', 138), ('well', 136), ('daughter', 135), ('cried', 134)]"
5061,The Children's Book of Christmas Stories (34),Unknown,"Feb 1, 2004",English,PZ: Language and Literatures: Juvenile belles lettres,Christmas stories,https://www.gutenberg.org/ebooks/5061,,,
5669,Considerations on Representative Government by John Stuart Mill (34),"Mill, John Stuart, 1806-1873","May 1, 2004",English,JC: Political science: Political theory,Representative government and representation,https://www.gutenberg.org/ebooks/5669,,,
28198,A Budget of Christmas Tales by Charles Dickens and Others (34),Unknown,"Feb 26, 2009",English,PZ: Language and Literatures: Juvenile belles lettres,Christmas stories,https://www.gutenberg.org/ebooks/28198,,,
25014,"Bouvard and Pécuchet: A Tragi-comic Novel of Bourgeois Life, part 1 by Gustave Flaubert (34)",Unknown,Unknown,Unknown,Unknown,,https://www.gutenberg.org/ebooks/25014,,,
2892,Irish Fairy Tales by James Stephens (34),"Stephens, James, 1882-1950","Nov 1, 2001",English,PR: Language and Literatures: English literature,"Tales -- Ireland, Folklore -- Ireland, Fairy tales -- Ireland",https://www.gutenberg.org/ebooks/2892,Irish Fairy Tales by James Stephens (34),"Nov 1, 2001","[('said', 639), ('fionn', 374), ('would', 292), ('one', 278), ('âi', 266), ('king', 240), ('could', 204), ('man', 170), ('great', 167), ('came', 149), ('mongan', 141), ('went', 136), ('mac', 135), ('time', 133), ('men', 108), ('son', 106), ('âand', 106), ('world', 103), ('ireland', 102), ('like', 101), ('must', 98), ('away', 96), ('chapter', 89), ('see', 88), ('know', 87), ('may', 85), ('come', 84), ('âit', 84), ('project', 83), ('people', 81)]"
821,Dombey and Son by Charles Dickens (34),"Dickens, Charles, 1812-1870","Feb 1, 1997",English,PR: Language and Literatures: English literature,"England -- Fiction, Dysfunctional families -- Fiction, Domestic fiction, Fathers and daughters -- Fiction, Businesspeople -- Fiction, Family-owned business enterprises -- Fiction",https://www.gutenberg.org/ebooks/821,,,
18241,"Tea-Cup Reading and Fortune-Telling by Tea Leaves, by a Highland Seer (34)",Unknown,"Apr 24, 2006",English,"BF: Philosophy, Psychology, Religion: Psychology, Philosophy, Psychoanalysis",Fortune-telling by tea leaves,https://www.gutenberg.org/ebooks/18241,,,
3250,"How to Tell a Story, and Other Essays by Mark Twain (34)","Twain, Mark, 1835-1910","Sep 19, 2004",English,PS: Language and Literatures: American and Canadian literature,"Essays, Short stories, Storytelling",https://www.gutenberg.org/ebooks/3250,"How to Tell a Story, and Other Essays by Mark Twain (34)","Sep 19, 2004","[('project', 82), ('gutenbergtm', 56), ('work', 48), ('said', 40), ('story', 34), ('en', 33), ('works', 32), ('got', 30), ('way', 27), ('electronic', 27), ('gutenberg', 25), ('terms', 25), ('one', 25), ('time', 25), ('de', 23), ('years', 20), ('foundation', 20), ('may', 19), ('know', 19), ('would', 19), ('pause', 19), ('tell', 18), ('must', 18), ('right', 18), ('went', 18), ('thompson', 18), ('agreement', 18), ('use', 15), ('license', 15), ('back', 15)]"
1750,Laws by Plato (34),"Plato, 427? BCE-347? BCE","May 1, 1999",English,JC: Political science: Political theory,"Political science -- Early works to 1800, State, The -- Early works to 1800",https://www.gutenberg.org/ebooks/1750,,,
34702,"Encyclopaedia Britannica, 11th Edition, ""Bible"" to ""Bisectrix"" by Various (34)",Various,"Dec 19, 2010",English,AE: General Works: Encyclopedias,Encyclopedias and dictionaries,https://www.gutenberg.org/ebooks/34702,,,
507,Adam Bede by George Eliot (34),"Eliot, George, 1819-1880","Jan 21, 2006",English,PR: Language and Literatures: English literature,"Didactic fiction, England -- Fiction, Love stories, Triangles (Interpersonal relations) -- Fiction, Illegitimate children -- Fiction, Women clergy -- Fiction, Infanticide -- Fiction, Carpenters -- Fiction",https://www.gutenberg.org/ebooks/507,Adam Bede by George Eliot (34),"Jan 21, 2006","[('said', 1208), ('adam', 1000), ('would', 720), ('oâ', 650), ('like', 625), ('hetty', 579), ('one', 547), ('could', 544), ('mr', 507), ('see', 482), ('come', 481), ('anâ', 442), ('go', 442), ('know', 439), ('little', 431), ('dinah', 397), ('must', 396), ('poyser', 391), ('old', 390), ('man', 389), ('think', 379), ('never', 364), ('thought', 359), ('got', 358), ('arthur', 349), ('itâs', 341), ('way', 328), ('make', 326), ('good', 322), ('might', 304)]"
37587,"The Katipunan; or, The Rise and Fall of the Filipino Commune by Francis St. Clair (34)",Unknown,Unknown,Unknown,Unknown,,https://www.gutenberg.org/ebooks/37587,,,
1292,The Way of the World by William Congreve (34),"Congreve, William, 1670-1729","Apr 1, 1998",English,PR: Language and Literatures: English literature,English drama (Comedy),https://www.gutenberg.org/ebooks/1292,The Way of the World by William Congreve (34),"Apr 1, 1998","[('mrs', 250), ('sir', 240), ('lady', 210), ('fain', 185), ('mira', 150), ('shall', 109), ('may', 107), ('would', 107), ('iâll', 107), ('wit', 105), ('madam', 103), ('mar', 101), ('one', 98), ('project', 87), ('milla', 86), ('mirabell', 85), ('âtis', 84), ('like', 83), ('come', 80), ('must', 80), ('thou', 76), ('well', 71), ('ay', 71), ('know', 69), ('think', 68), ('dear', 66), ('scene', 63), ('let', 62), ('ha', 60), ('make', 59)]"
72273,As many as touched Him by Eglanton Thorne (34),"Thorne, Eglanton, 1852-1907","Dec 1, 2023",English,PZ: Language and Literatures: Juvenile belles lettres,"Christian life -- Juvenile fiction, Friendship -- Juvenile fiction, Siblings -- Juvenile fiction, Country life -- Juvenile fiction, Sick children -- Juvenile fiction, Fire -- Juvenile fiction, Dressmakers -- Juvenile fiction, Burns and scalds -- Juvenile fiction",https://www.gutenberg.org/ebooks/72273,As many as touched Him by Eglanton Thorne (34),"Dec 1, 2023","[('ellen', 207), ('would', 115), ('miss', 108), ('said', 100), ('jerry', 91), ('could', 73), ('little', 65), ('one', 62), ('mary', 62), ('home', 60), ('graham', 60), ('mansfield', 58), ('mother', 57), ('come', 55), ('think', 54), ('oh', 51), ('words', 50), ('many', 48), ('see', 48), ('julia', 46), ('much', 45), ('replied', 45), ('well', 45), ('go', 43), ('time', 40), ('say', 40), ('made', 39), ('felt', 38), ('aunt', 37), ('know', 37)]"
33,The Scarlet Letter by Nathaniel Hawthorne (34),"Hawthorne, Nathaniel, 1804-1864","Jun 1, 1992",English,PS: Language and Literatures: American and Canadian literature,"Adultery -- Fiction, Historical fiction, Revenge -- Fiction, Psychological fiction, Married women -- Fiction, Clergy -- Fiction, Triangles (Interpersonal relations) -- Fiction, Illegitimate children -- Fiction, Women immigrants -- Fiction, Puritans -- Fiction, Boston (Mass.) -- History -- Colonial period, ca. 1600-1775 -- Fiction",https://www.gutenberg.org/ebooks/33,The Scarlet Letter by Nathaniel Hawthorne (34),"Jun 1, 1992","[('hester', 336), ('would', 278), ('little', 234), ('one', 228), ('old', 211), ('thou', 201), ('pearl', 187), ('could', 179), ('might', 179), ('upon', 177), ('man', 166), ('child', 154), ('minister', 150), ('said', 148), ('life', 146), ('prynne', 138), ('letter', 130), ('may', 130), ('scarlet', 121), ('mr', 121), ('heart', 117), ('like', 116), ('good', 116), ('mother', 113), ('yet', 112), ('hand', 106), ('must', 106), ('made', 104), ('never', 100), ('long', 100)]"
2981,"The Memoirs of Jacques Casanova de Seingalt, 1725-1798. Complete by Giacomo Casanova (34)","Casanova, Giacomo, 1725-1798","Nov 11, 2004",English,D: History: General and Eastern Hemisphere,"Casanova, Giacomo, 1725-1798, Europe -- History -- 18th century -- Biography",https://www.gutenberg.org/ebooks/2981,,,
30107,Principles of Political Economy by John Stuart Mill (34),"Mill, John Stuart, 1806-1873","Sep 27, 2009",English,"HB: Social sciences: Economic theory, Demography",Economics,https://www.gutenberg.org/ebooks/30107,Principles of Political Economy by John Stuart Mill (34),"Sep 27, 2009","[('would', 1046), ('capital', 1015), ('labor', 867), ('value', 792), ('money', 764), ('one', 745), ('production', 718), ('wages', 697), ('cost', 618), ('may', 613), ('country', 564), ('states', 486), ('â', 483), ('demand', 482), ('increase', 470), ('united', 461), ('price', 451), ('land', 424), ('commodities', 403), ('much', 397), ('must', 388), ('produce', 388), ('amount', 376), ('profits', 362), ('england', 359), ('general', 352), ('less', 337), ('population', 331), ('quantity', 321), ('prices', 316)]"
3820,Nathan the Wise; a dramatic poem in five acts by Gotthold Ephraim Lessing (34),"Lessing, Gotthold Ephraim, 1729-1781","Mar 1, 2003",English,"PT: Language and Literatures: Germanic, Scandinavian, and Icelandic literatures",German drama -- Translations into English,https://www.gutenberg.org/ebooks/3820,Nathan the Wise; a dramatic poem in five acts by Gotthold Ephraim Lessing (34),"Mar 1, 2003","[('nathan', 438), ('templar', 298), ('saladin', 249), ('daya', 196), ('sittah', 161), ('recha', 141), ('thou', 126), ('thee', 109), ('one', 99), ('may', 98), ('thy', 98), ('must', 97), ('âtis', 95), ('hafi', 93), ('project', 89), ('friar', 89), ('yet', 87), ('know', 87), ('well', 81), ('father', 80), ('man', 76), ('god', 72), ('would', 68), ('shall', 68), ('come', 67), ('patriarch', 64), ('much', 61), ('upon', 61), ('good', 59), ('see', 59)]"
47018,"A Dictionary of Slang, Cant, and Vulgar Words by John Camden Hotten (34)",Unknown,Unknown,Unknown,Unknown,,https://www.gutenberg.org/ebooks/47018,,,
610,Idylls of the King by Baron Alfred Tennyson Tennyson (34),Unknown,Unknown,Unknown,Unknown,,https://www.gutenberg.org/ebooks/610,Idylls of the King by Baron Alfred Tennyson Tennyson (34),Unknown,"[('king', 423), ('one', 343), ('thou', 309), ('ye', 264), ('said', 250), ('thee', 245), ('love', 226), ('thy', 223), ('lancelot', 205), ('like', 197), ('upon', 190), ('sir', 186), ('man', 170), ('made', 166), ('knight', 164), ('arthur', 163), ('great', 156), ('yet', 155), ('would', 148), ('queen', 147), ('came', 141), ('let', 138), ('till', 134), ('saw', 130), ('eyes', 119), ('know', 118), ('heart', 117), ('men', 115), ('answered', 114), ('mine', 113)]"
5658,Lord Jim by Joseph Conrad (34),"Conrad, Joseph, 1857-1924","Jan 9, 2006",English,PR: Language and Literatures: English literature,"Psychological fiction, Atonement -- Fiction, Merchant marine -- Officers -- Fiction, British -- Indonesia -- Fiction, Cowardice -- Fiction, Indonesia -- Fiction",https://www.gutenberg.org/ebooks/5658,Lord Jim by Joseph Conrad (34),"Jan 9, 2006","[('would', 527), ('said', 402), ('like', 401), ('one', 393), ('could', 384), ('man', 321), ('jim', 276), ('made', 267), ('time', 256), ('little', 234), ('know', 228), ('upon', 223), ('seemed', 219), ('âi', 218), ('head', 213), ('men', 207), ('eyes', 195), ('see', 190), ('old', 183), ('back', 178), ('without', 176), ('though', 172), ('two', 167), ('last', 165), ('go', 158), ('nothing', 154), ('went', 154), ('came', 153), ('come', 153), ('donât', 152)]"
19860,The Arabian Nights Entertainments by Anonymous (34),Unknown,Unknown,Unknown,Unknown,,https://www.gutenberg.org/ebooks/19860,,,
5427,Emile by Jean-Jacques Rousseau (34),"Rousseau, Jean-Jacques, 1712-1778","Apr 1, 2004",English,LB: Education: Theory and practice of education,Education -- Early works to 1800,https://www.gutenberg.org/ebooks/5427,,,
60497,"Storia di Milano, vol. 1 by Pietro Verri (34)","Verri, Pietro, 1728-1797","Oct 15, 2019",Italian,"DG: History: General and Eastern Hemisphere: Italy, Vatican City, Malta",Milan (Italy) -- History,https://www.gutenberg.org/ebooks/60497,"Storia di Milano, vol. 1 by Pietro Verri (34)","Oct 15, 2019","[('di', 3876), ('e', 3519), ('che', 2626), ('il', 2202), ('la', 2120), ('non', 1286), ('si', 1239), ('per', 1222), ('del', 911), ('della', 882), ('le', 870), ('un', 832), ('da', 708), ('al', 567), ('milano', 548), ('era', 524), ('piã¹', 522), ('cittã', 520), ('de', 517), ('una', 511), ('gli', 482), ('con', 460), ('ã', 459), ('nel', 449), ('et', 433), ('lo', 421), ('se', 390), ('alla', 382), ('loro', 367), ('fu', 361)]"
23717,Jabberwocky by Lewis Carroll (34),"Carroll, Lewis, 1832-1898","Dec 1, 2007",English,PR: Language and Literatures: English literature,"Nonsense verses, Fantasy poetry",https://www.gutenberg.org/ebooks/23717,,,
45814,An Advanced English Grammar with Exercises by Frank Edgar Farley and George Lyman Kittredge (33),Unknown,Unknown,Unknown,Unknown,,https://www.gutenberg.org/ebooks/45814,An Advanced English Grammar with Exercises by Frank Edgar Farley and George Lyman Kittredge (33),Unknown,"[('may', 490), ('2', 452), ('1', 426), ('clause', 413), ('used', 386), ('3', 359), ('subject', 357), ('adjective', 348), ('predicate', 343), ('â', 342), ('object', 324), ('sentences', 305), ('clauses', 302), ('f', 300), ('ff', 294), ('verb', 288), ('see', 288), ('sentence', 276), ('noun', 271), ('compound', 244), ('verbs', 243), ('past', 231), ('called', 227), ('infinitive', 218), ('words', 216), ('struck', 216), ('two', 214), ('one', 211), ('person', 200), ('use', 194)]"
1094,Tamburlaine the Great — Part 1 by Christopher Marlowe (33),"Marlowe, Christopher, 1564-1593","Nov 1, 1997",English,PR: Language and Literatures: English literature,"Timur, 1336-1405 -- Drama, English drama, Tragedies, Historical drama",https://www.gutenberg.org/ebooks/1094,,,
598,"Heimskringla; Or, The Chronicle of the Kings of Norway by Snorri Sturluson (33)",Unknown,Unknown,Unknown,Unknown,,https://www.gutenberg.org/ebooks/598,,,
19466,The Marvelous Land of Oz by L. Frank  Baum (33),Unknown,Unknown,Unknown,Unknown,,https://www.gutenberg.org/ebooks/19466,,,
5001,Relativity : the Special and General Theory by Albert Einstein (33),Unknown,Unknown,Unknown,Unknown,,https://www.gutenberg.org/ebooks/5001,,,
70,What Is Man? and Other Essays by Mark Twain (33),"Twain, Mark, 1835-1910","Sep 13, 2004",English,PS: Language and Literatures: American and Canadian literature,American essays,https://www.gutenberg.org/ebooks/70,,,
14988,Cicero's Tusculan Disputations by Marcus Tullius Cicero (33),Unknown,Unknown,Unknown,Unknown,,https://www.gutenberg.org/ebooks/14988,,,
520,The Life and Adventures of Santa Claus by L. Frank  Baum (33),Unknown,Unknown,Unknown,Unknown,,https://www.gutenberg.org/ebooks/520,,,
2587,Life Is a Dream by Pedro Calderón de la Barca (33),"Calderón de la Barca, Pedro, 1600-1681","Mar 31, 2006",English,"PQ: Language and Literatures: Romance literatures: French, Italian, Spanish, Portuguese",Drama,https://www.gutenberg.org/ebooks/2587,,,
71536,Books and their makers during the Middle Ages : by George Haven Putnam (33),Unknown,Unknown,Unknown,Unknown,,https://www.gutenberg.org/ebooks/71536,Books and their makers during the Middle Ages : by George Haven Putnam (33),Unknown,"[('ii', 961), ('books', 815), ('work', 723), ('university', 403), ('manuscripts', 392), ('first', 390), ('time', 369), ('paris', 357), ('literary', 344), ('century', 339), ('one', 338), ('_ff_', 323), ('literature', 302), ('also', 286), ('italy', 267), ('later', 250), ('years', 250), ('monastery', 250), ('library', 245), ('business', 241), ('works', 238), ('de', 236), ('however', 227), ('important', 226), ('monasteries', 222), ('manuscript', 222), ('printed', 220), ('printing', 218), ('great', 216), ('scribes', 212)]"
20847,India: What can it teach us? by F. Max  Müller (33),"Müller, F. Max (Friedrich Max), 1823-1900","Mar 18, 2007",English,DS: History: General and Eastern Hemisphere: Asia,"India, Sanskrit literature -- History and criticism, Vedas",https://www.gutenberg.org/ebooks/20847,,,
50280,Latin Phrase-Book by Carl Meissner (33),"Meissner, Carl, 1830-","Oct 22, 2015",Latin,PA: Language and Literatures: Classical Languages and Literature,"Latin language -- Idioms, Latin language -- Terms and phrases",https://www.gutenberg.org/ebooks/50280,,,
2197,The Gambler by Fyodor Dostoyevsky (33),"Dostoyevsky, Fyodor, 1821-1881","May 1, 2000",English,"PG: Language and Literatures: Slavic (including Russian), Languages and Literature","Psychological fiction, Gamblers -- Fiction, Gambling -- Fiction, Families -- Fiction, Russians -- Germany -- Fiction, Chance -- Fiction",https://www.gutenberg.org/ebooks/2197,The Gambler by Fyodor Dostoyevsky (33),"May 1, 2000","[('general', 188), ('would', 187), ('upon', 184), ('one', 173), ('could', 157), ('even', 155), ('yet', 150), ('though', 135), ('said', 135), ('polina', 133), ('mlle', 127), ('de', 127), ('know', 118), ('also', 117), ('see', 116), ('old', 116), ('may', 110), ('time', 110), ('money', 104), ('grandmother', 104), ('must', 101), ('well', 97), ('thousand', 96), ('come', 95), ('blanche', 95), ('never', 93), ('two', 90), ('project', 88), ('griers', 86), ('âi', 81)]"
2145,Ben-Hur: A tale of the Christ by Lew Wallace (33),"Wallace, Lew, 1827-1905","Apr 1, 2000",English,PS: Language and Literatures: American and Canadian literature,"Historical fiction, Jesus Christ -- Fiction, Christian fiction, Rome -- History -- Tiberius, 14-37 -- Fiction, Tiberius, Emperor of Rome 42 B.C.-37 A.D. -- Fiction, Bible. New Testament -- History of Biblical events -- Fiction",https://www.gutenberg.org/ebooks/2145,Ben-Hur: A tale of the Christ by Lew Wallace (33),"Apr 1, 2000","[('said', 769), ('one', 666), ('upon', 650), ('benhur', 604), ('would', 509), ('man', 429), ('thou', 380), ('could', 348), ('âi', 344), ('time', 316), ('see', 306), ('us', 289), ('yet', 285), ('hand', 269), ('came', 263), ('first', 258), ('may', 252), ('like', 252), ('thy', 250), ('come', 247), ('âthe', 244), ('great', 243), ('son', 238), ('say', 233), ('go', 227), ('face', 227), ('eyes', 227), ('god', 227), ('life', 224), ('good', 223)]"
1252,Le Morte d'Arthur: Volume 2 by Sir Thomas Malory (33),"Malory, Thomas, Sir, -1471","Mar 1, 1998",English,PR: Language and Literatures: English literature,"Arthurian romances, Arthur, King -- Legends",https://www.gutenberg.org/ebooks/1252,Le Morte d'Arthur: Volume 2 by Sir Thomas Malory (33),"Mar 1, 1998","[('sir', 6581), ('said', 2690), ('launcelot', 1674), ('ye', 1661), ('king', 1591), ('knight', 1379), ('shall', 954), ('tristram', 933), ('knights', 914), ('well', 882), ('came', 868), ('unto', 813), ('great', 759), ('palomides', 668), ('upon', 609), ('arthur', 597), ('queen', 577), ('good', 559), ('thou', 555), ('made', 540), ('would', 538), ('chapter', 530), ('ever', 485), ('saw', 478), ('man', 471), ('gawaine', 444), ('never', 438), ('might', 433), ('may', 424), ('bors', 399)]"
653,The Chimes by Charles Dickens (33),"Dickens, Charles, 1812-1870","Sep 1, 1996",English,PR: Language and Literatures: English literature,"Christmas stories, Holidays -- Fiction",https://www.gutenberg.org/ebooks/653,The Chimes by Charles Dickens (33),"Sep 1, 1996","[('said', 248), ('trotty', 155), ('upon', 111), ('toby', 107), ('one', 100), ('meg', 87), ('project', 86), ('old', 84), ('man', 78), ('work', 76), ('good', 65), ('little', 61), ('alderman', 61), ('donât', 60), ('like', 60), ('âi', 60), ('sir', 60), ('face', 58), ('gutenbergtm', 56), ('new', 55), ('great', 54), ('saw', 54), ('cried', 53), ('year', 51), ('mr', 51), ('know', 50), ('hand', 50), ('would', 47), ('round', 47), ('come', 47)]"
65662,Der Zauberberg. Zweiter Band by Thomas Mann (33),"Mann, Thomas, 1875-1955","Jun 21, 2021",German,"PT: Language and Literatures: Germanic, Scandinavian, and Icelandic literatures","Germany -- Fiction, Sanatoriums -- Fiction",https://www.gutenberg.org/ebooks/65662,Der Zauberberg. Zweiter Band by Thomas Mann (33),"Jun 21, 2021","[('und', 6037), ('die', 4029), ('der', 3886), ('er', 2546), ('zu', 2261), ('das', 2259), ('sie', 2053), ('sich', 1926), ('es', 1862), ('mit', 1734), ('den', 1655), ('nicht', 1616), ('â', 1467), ('war', 1424), ('von', 1337), ('dem', 1250), ('auf', 1207), ('des', 1102), ('daã', 1100), ('ein', 1076), ('ich', 909), ('wie', 897), ('ist', 888), ('eine', 815), ('als', 811), ('im', 804), ('aber', 788), ('hatte', 763), ('hans', 743), ('auch', 740)]"
34704,"British Goblins: Welsh Folk-lore, Fairy Mythology, Legends and Traditions by Wirt Sikes (33)","Sikes, Wirt, 1836-1883","Dec 20, 2010",English,"GR: Geography, Anthropology, Recreation: Folklore","Mythology, Celtic -- Wales, Wales -- Social life and customs, Folklore -- Wales, Mythology, Welsh, Goblins -- Wales",https://www.gutenberg.org/ebooks/34704,,,
15238,Mathilda by Mary Wollstonecraft Shelley (33),"Shelley, Mary Wollstonecraft, 1797-1851","Mar 2, 2005",English,PR: Language and Literatures: English literature,"Fathers and daughters -- Fiction, Guilt -- Fiction, Incest -- Fiction",https://www.gutenberg.org/ebooks/15238,Mathilda by Mary Wollstonecraft Shelley (33),"Mar 2, 2005","[('one', 166), ('would', 150), ('could', 119), ('father', 114), ('love', 113), ('life', 111), ('must', 104), ('ever', 100), ('words', 95), ('yet', 95), ('heart', 93), ('see', 93), ('eyes', 92), ('project', 90), ('may', 86), ('might', 83), ('never', 81), ('mary', 73), ('death', 69), ('_f', 67), ('upon', 63), ('every', 62), ('work', 59), ('shall', 59), ('many', 58), ('time', 57), ('day', 57), ('_mathilda_', 56), ('tears', 56), ('hope', 56)]"
22542,Jesus the Christ by James E.  Talmage (33),"Talmage, James E. (James Edward), 1862-1933","Sep 8, 2007",English,"BX: Philosophy, Psychology, Religion: Christianity: Churches, Church movements","Jesus Christ -- Biography, Jesus Christ -- Mormon interpretations, Christian biography -- Palestine",https://www.gutenberg.org/ebooks/22542,,,
28497,Myths of the Norsemen: From the Eddas and Sagas by H. A.  Guerber (33),Unknown,Unknown,Unknown,Unknown,,https://www.gutenberg.org/ebooks/28497,,,
22699,Pipefuls by Christopher Morley (33),"Morley, Christopher, 1890-1957","Sep 21, 2007",English,PS: Language and Literatures: American and Canadian literature,Essays,https://www.gutenberg.org/ebooks/22699,,,
2166,King Solomon's Mines by H. Rider  Haggard (33),"Haggard, H. Rider (Henry Rider), 1856-1925","May 1, 2000",English,PR: Language and Literatures: English literature,"Africa -- Fiction, Missing persons -- Fiction, Adventure stories, Treasure troves -- Fiction, Hunting guides -- Fiction, Diamond mines and mining -- Fiction, Quatermain, Allan (Fictitious character) -- Fiction",https://www.gutenberg.org/ebooks/2166,King Solomon's Mines by H. Rider  Haggard (33),"May 1, 2000","[('us', 418), ('said', 299), ('good', 270), ('one', 240), ('sir', 236), ('henry', 211), ('man', 208), ('upon', 179), ('great', 174), ('like', 165), ('could', 164), ('white', 160), ('would', 158), ('shall', 158), ('king', 156), ('old', 152), ('men', 152), ('see', 149), ('came', 137), ('thou', 137), ('little', 128), ('ye', 127), ('went', 121), ('two', 117), ('come', 112), ('made', 112), ('three', 108), ('way', 107), ('time', 106), ('twala', 104)]"
153,Jude the Obscure by Thomas Hardy (33),"Hardy, Thomas, 1840-1928","Aug 1, 1994",English,PR: Language and Literatures: English literature,"Adultery -- Fiction, Didactic fiction, Love stories, Illegitimate children -- Fiction, Wessex (England) -- Fiction, Stonemasons -- Fiction, Children -- Death -- Fiction, Unmarried couples -- Fiction",https://www.gutenberg.org/ebooks/153,Jude the Obscure by Thomas Hardy (33),"Aug 1, 1994","[('said', 776), ('jude', 768), ('âi', 485), ('sue', 465), ('one', 426), ('would', 421), ('could', 369), ('donât', 354), ('little', 321), ('like', 303), ('come', 286), ('know', 283), ('see', 266), ('go', 255), ('went', 245), ('arabella', 243), ('time', 242), ('back', 236), ('man', 228), ('think', 202), ('must', 198), ('though', 197), ('came', 194), ('thought', 192), ('much', 190), ('never', 190), ('seemed', 180), ('till', 179), ('phillotson', 179), ('two', 175)]"
36542,The American Occupation of the Philippines 1898-1912 by James H.  Blount (33),Unknown,Unknown,Unknown,Unknown,,https://www.gutenberg.org/ebooks/36542,,,
