Book ID,Title_x,Author,Publication Date,Language,LoC Class,Subjects,Link,Title_y,Date,Most Common Words
830,The Argonautica by Rhodius Apollonius (50),"Apollonius, Rhodius","Feb 1, 1997",English,PA: Language and Literatures: Classical Languages and Literature,"Classical literature, Argonauts (Greek mythology), Jason -- (Mythological character), Medea, consort of Aegeus, King of Athens (Mythological character)",https://www.gutenberg.org/ebooks/830,,,
32449,Japanese Girls and Women by Alice Mabel Bacon (50),Unknown,Unknown,Unknown,Unknown,,https://www.gutenberg.org/ebooks/32449,Japanese Girls and Women by Alice Mabel Bacon (50),Unknown,"[('one', 482), ('japanese', 413), ('women', 300), ('japan', 279), ('upon', 252), ('life', 242), ('little', 242), ('family', 230), ('old', 224), ('many', 221), ('must', 220), ('may', 211), ('house', 196), ('great', 195), ('new', 193), ('work', 187), ('time', 175), ('wife', 168), ('much', 155), ('children', 154), ('even', 153), ('country', 144), ('made', 142), ('woman', 140), ('men', 138), ('years', 137), ('would', 134), ('young', 127), ('every', 123), ('day', 123)]"
28233,Philosophiae Naturalis Principia Mathematica by Isaac Newton (50),Unknown,Unknown,Unknown,Unknown,,https://www.gutenberg.org/ebooks/28233,,,
11224,Utilitarianism by John Stuart Mill (50),Unknown,Unknown,Unknown,Unknown,,https://www.gutenberg.org/ebooks/11224,,,
5657,The Practice of the Presence of God by Brother of the Resurrection Lawrence (50),Unknown,Unknown,Unknown,Unknown,,https://www.gutenberg.org/ebooks/5657,,,
42704,Salomé: A Tragedy in One Act by Oscar Wilde (50),"Wilde, Oscar, 1854-1900","May 12, 2013",English,PR: Language and Literatures: English literature,"Salome (Biblical figure) -- Drama, Tragedies",https://www.gutenberg.org/ebooks/42704,,,
39452,The Pilgrim's Progress by John Bunyan Every Child Can Read by John Bunyan (50),Unknown,Unknown,Unknown,Unknown,,https://www.gutenberg.org/ebooks/39452,,,
43060,"Encyclopaedia Britannica, 11th Edition, ""McKinley, William"" to ""Magnetism, Terrestrial"" by Various (50)",Various,"Jun 29, 2013",English,AE: General Works: Encyclopedias,Encyclopedias and dictionaries,https://www.gutenberg.org/ebooks/43060,,,
16322,Luther Examined and Reexamined by W. H. T.  Dau (50),"Dau, W. H. T. (William Herman Theodore), 1864-1944","Jul 18, 2005",English,"BR: Philosophy, Psychology, Religion: Christianity","Luther, Martin, 1483-1546",https://www.gutenberg.org/ebooks/16322,,,
15043,"The Works of the Right Honourable Edmund Burke, Vol. 01 (of 12) by Edmund Burke (49)","Burke, Edmund, 1729-1797","Feb 14, 2005",English,"DA: History: General and Eastern Hemisphere: Great Britain, Ireland, Central Europe","Great Britain -- Politics and government -- 1760-1820, Political science -- Early works to 1800",https://www.gutenberg.org/ebooks/15043,,,
51764,Fiue Hundred Pointes of Good Husbandrie by Thomas Tusser (49),"Tusser, Thomas, 1524?-1580","Apr 15, 2016",English,PE: Language and Literatures: English,"Home economics, Agriculture -- Early works to 1800, English language -- Terms and phrases -- Early works to 1800, English language -- Provincialisms -- Early works to 1800",https://www.gutenberg.org/ebooks/51764,Fiue Hundred Pointes of Good Husbandrie by Thomas Tusser (49),"Apr 15, 2016","[('_s_', 723), ('good', 593), ('thy', 543), ('sidenote', 436), ('may', 335), ('1577', 327), ('ye', 319), ('p', 265), ('see', 249), ('one', 242), ('make', 238), ('haue', 237), ('doth', 230), ('1', 221), ('thou', 219), ('well', 210), ('time', 208), ('2', 206), ('shall', 204), ('let', 191), ('take', 190), ('3', 186), ('_v_', 180), ('also', 176), ('husbandrie', 174), ('pl_', 174), ('â', 171), ('_s', 170), ('called', 166), ('much', 162)]"
131,The Pilgrim's Progress from this world to that which is to come by John Bunyan (49),"Bunyan, John, 1628-1688","May 1, 1994",English,PR: Language and Literatures: English literature,"Christian fiction, Christian pilgrims and pilgrimages -- Fiction",https://www.gutenberg.org/ebooks/131,The Pilgrim's Progress from this world to that which is to come by John Bunyan (49),"May 1, 1994","[('said', 333), ('chr', 273), ('way', 252), ('christian', 250), ('man', 243), ('thou', 230), ('also', 198), ('go', 175), ('things', 171), ('come', 160), ('good', 158), ('came', 153), ('would', 152), ('upon', 150), ('one', 147), ('shall', 143), ('men', 140), ('us', 134), ('see', 131), ('therefore', 130), ('thee', 129), ('yet', 124), ('saw', 124), ('god', 121), ('may', 119), ('went', 116), ('faith', 112), ('thus', 106), ('hope', 99), ('thy', 98)]"
139,The Lost World by Arthur Conan Doyle (49),"Doyle, Arthur Conan, 1859-1930","Jun 1, 1994",English,PR: Language and Literatures: English literature,"Challenger, Professor (Fictitious character) -- Fiction, Fantasy fiction, South America -- Fiction, Prehistoric peoples -- Fiction, Dinosaurs -- Fiction",https://www.gutenberg.org/ebooks/139,,,
32415,The Nursery Rhymes of England (49),Unknown,"May 18, 2010",English,"PN: Language and Literatures: Literature: General, Criticism, Collections","Nursery rhymes, English, Oral tradition -- England",https://www.gutenberg.org/ebooks/32415,,,
11757,The Velveteen Rabbit by Margery Williams Bianco (49),"Bianco, Margery Williams, 1881-1944","Mar 1, 2004",English,PZ: Language and Literatures: Juvenile belles lettres,"Toys -- Juvenile fiction, Rabbits -- Juvenile fiction",https://www.gutenberg.org/ebooks/11757,,,
13707,Twice-told tales by Nathaniel Hawthorne (49),"Hawthorne, Nathaniel, 1804-1864","Oct 11, 2004",English,PS: Language and Literatures: American and Canadian literature,"Short stories, New England -- Social life and customs -- Fiction, Historical fiction, American",https://www.gutenberg.org/ebooks/13707,,,
887,Intentions by Oscar Wilde (49),"Wilde, Oscar, 1854-1900","Apr 1, 1997",English,PR: Language and Literatures: English literature,"Authors, English -- 19th century -- Biography, Authorship, English drama, Authors, English -- 19th century -- Drama, Art critics -- Great Britain -- Biography, Wainewright, Thomas Griffiths, 1794-1847, Poisoners -- Great Britain -- Biography",https://www.gutenberg.org/ebooks/887,Intentions by Oscar Wilde (49),"Apr 1, 1997","[('us', 302), ('art', 274), ('one', 274), ('life', 186), ('work', 147), ('may', 132), ('always', 112), ('form', 108), ('great', 106), ('ernest', 102), ('like', 95), ('man', 91), ('gilbert', 88), ('project', 87), ('would', 87), ('upon', 81), ('beauty', 80), ('nature', 79), ('people', 77), ('true', 77), ('world', 76), ('much', 76), ('must', 76), ('age', 75), ('things', 74), ('criticism', 74), ('time', 73), ('critic', 70), ('thing', 70), ('see', 69)]"
6124,"Pamela, or Virtue Rewarded by Samuel Richardson (49)","Richardson, Samuel, 1689-1761","Jul 1, 2004",English,PR: Language and Literatures: English literature,"Didactic fiction, England -- Fiction, Epistolary fiction, Master and servant -- Fiction, Kidnapping victims -- Fiction, Virtue -- Fiction, Women household employees -- Fiction",https://www.gutenberg.org/ebooks/6124,,,
51,Anne of the Island by L. M.  Montgomery (49),Unknown,Unknown,Unknown,Unknown,,https://www.gutenberg.org/ebooks/51,Anne of the Island by L. M.  Montgomery (49),Unknown,"[('anne', 874), ('said', 573), ('one', 305), ('âi', 273), ('would', 256), ('like', 233), ('never', 218), ('mrs', 209), ('donât', 207), ('old', 206), ('little', 184), ('iâm', 169), ('could', 162), ('think', 158), ('know', 155), ('phil', 152), ('going', 148), ('gilbert', 146), ('go', 142), ('see', 139), ('davy', 132), ('time', 131), ('come', 122), ('always', 120), ('thought', 119), ('ever', 119), ('good', 117), ('itâs', 116), ('diana', 115), ('came', 115)]"
1430,Beautiful Stories from Shakespeare by E.  Nesbit and William Shakespeare (48),"Nesbit, E. (Edith), 1858-1924","Aug 1, 1998",English,PZ: Language and Literatures: Juvenile belles lettres,"Children's literature, Shakespeare, William, 1564-1616 -- Stories, plots, etc. -- Juvenile literature",https://www.gutenberg.org/ebooks/1430,,,
28885,Alice's Adventures in Wonderland by Lewis Carroll (48),Unknown,Unknown,Unknown,Unknown,,https://www.gutenberg.org/ebooks/28885,,,
6688,The Mill on the Floss by George Eliot (48),Unknown,Unknown,Unknown,Unknown,,https://www.gutenberg.org/ebooks/6688,The Mill on the Floss by George Eliot (48),Unknown,"[('said', 1609), ('maggie', 1123), ('tom', 960), ('mr', 910), ('would', 807), ('tulliver', 587), ('mrs', 579), ('like', 530), ('one', 502), ('could', 477), ('oâ', 404), ('little', 394), ('come', 382), ('must', 372), ('never', 369), ('philip', 365), ('know', 361), ('âi', 359), ('see', 358), ('made', 334), ('go', 331), ('thought', 329), ('think', 319), ('glegg', 309), ('much', 305), ('lucy', 291), ('might', 291), ('good', 287), ('make', 284), ('mind', 279)]"
72274,A song-bird by Eleanora H. Stooke (48),"Stooke, Eleanora H.","Dec 1, 2023",English,PZ: Language and Literatures: Juvenile belles lettres,"Christian life -- Juvenile fiction, Conduct of life -- Juvenile fiction, England -- Juvenile fiction, Girls -- Juvenile fiction",https://www.gutenberg.org/ebooks/72274,A song-bird by Eleanora H. Stooke (48),"Dec 1, 2023","[('mavis', 314), ('mother', 159), ('said', 115), ('rose', 108), ('little', 102), ('mrs', 100), ('one', 87), ('would', 87), ('miss', 84), ('oh', 83), ('dont', 80), ('aunt', 76), ('like', 67), ('grey', 62), ('john', 59), ('yes', 58), ('shall', 58), ('think', 57), ('mr', 56), ('dawson', 55), ('never', 55), ('see', 54), ('know', 50), ('house', 48), ('dear', 48), ('must', 47), ('im', 46), ('father', 45), ('girl', 44), ('well', 44)]"
62,A Princess of Mars by Edgar Rice Burroughs (48),Unknown,Unknown,Unknown,Unknown,,https://www.gutenberg.org/ebooks/62,A Princess of Mars by Edgar Rice Burroughs (48),Unknown,"[('upon', 436), ('one', 244), ('would', 221), ('could', 210), ('dejah', 176), ('great', 160), ('thoris', 159), ('us', 133), ('toward', 123), ('little', 120), ('warriors', 116), ('sola', 114), ('martian', 107), ('two', 103), ('green', 103), ('first', 101), ('men', 98), ('tars', 96), ('helium', 96), ('time', 93), ('without', 90), ('feet', 89), ('project', 88), ('tarkas', 84), ('city', 84), ('man', 82), ('may', 78), ('know', 77), ('among', 77), ('must', 76)]"
583,The Woman in White by Wilkie Collins (48),"Collins, Wilkie, 1824-1889","Jul 1, 1996",English,PR: Language and Literatures: English literature,"Inheritance and succession -- Fiction, England -- Fiction, Psychological fiction, Love stories, Country homes -- Fiction, Gothic fiction, Nobility -- Fiction, Deception -- Fiction, Art teachers -- Fiction, Psychiatric hospital patients -- Fiction",https://www.gutenberg.org/ebooks/583,The Woman in White by Wilkie Collins (48),"Jul 1, 1996","[('said', 852), ('sir', 742), ('one', 690), ('time', 646), ('could', 593), ('mr', 576), ('miss', 572), ('percival', 541), ('us', 490), ('first', 478), ('âi', 472), ('little', 452), ('would', 448), ('mrs', 441), ('house', 432), ('man', 413), ('count', 400), ('back', 392), ('say', 386), ('left', 378), ('lady', 363), ('halcombe', 347), ('see', 336), ('might', 335), ('know', 326), ('last', 322), ('looked', 320), ('laura', 315), ('face', 307), ('fairlie', 298)]"
15725,Doña Perfecta by Benito Pérez Galdós (48),"Pérez Galdós, Benito, 1843-1920","Apr 28, 2005",English,"PQ: Language and Literatures: Romance literatures: French, Italian, Spanish, Portuguese","Married women -- Fiction, Spanish language -- Readers, Spain -- Social life and customs -- 19th century -- Fiction, Religion and politics -- Spain -- History -- 19th century -- Fiction, Liberalism -- Spain -- History -- 19th century -- Fiction, Social conflict -- Spain -- History -- 19th century -- Fiction",https://www.gutenberg.org/ebooks/15725,,,
36205,Η Φόνισσα by Alexandros Papadiamantes (48),"Papadiamantes, Alexandros, 1851-1911","May 23, 2011",Greek,PA: Language and Literatures: Classical Languages and Literature,"Greek fiction, Modern, Women peasants -- Greece -- Skiathos Island -- Psychology -- Fiction, Women murderers -- Greece -- Skiathos Island -- Fiction, Skiathos Island (Greece) -- Social conditions -- Fiction",https://www.gutenberg.org/ebooks/36205,Η Φόνισσα by Alexandros Papadiamantes (48),"May 23, 2011","[('ïîï', 3392), ('ïî', 2527), ('ïîî½', 2429), ('î', 2244), ('îºîî¹', 1705), ('î½î', 1412), ('îµî¹ï', 1081), ('ï', 972), ('ïï', 849), ('îï', 849), ('â', 670), ('îïï', 557), ('îïî', 508), ('îîµî½', 493), ('îî', 487), ('î¼îµ', 484), ('ïïî½', 413), ('î¼îï', 411), ('ïïîï', 408), ('îµîïîµ', 395), ('î½', 393), ('îº', 329), ('îî¹', 300), ('îî¹î', 267), ('îïîî½', 260), ('ïïî', 258), ('îµîïîµî½', 254), ('ïïî¹', 246), ('îîîî', 216), ('îî½', 212)]"
31591,Language of Flowers by Kate Greenaway (48),"Greenaway, Kate, 1846-1901","Mar 10, 2010",English,"GR: Geography, Anthropology, Recreation: Folklore","Flowers -- Poetry, Flower language",https://www.gutenberg.org/ebooks/31591,,,
6157,"What Men Live By, and Other Tales by graf Leo Tolstoy (47)","Tolstoy, Leo, graf, 1828-1910","Jul 1, 2004",English,"PG: Language and Literatures: Slavic (including Russian), Languages and Literature","Russia -- Fiction, Peasants -- Russia -- Fiction",https://www.gutenberg.org/ebooks/6157,,,
1695,The Man Who Was Thursday: A Nightmare by G. K.  Chesterton (47),"Chesterton, G. K. (Gilbert Keith), 1874-1936","Apr 1, 1999",English,PR: Language and Literatures: English literature,"Fantasy fiction, Detective and mystery stories, London (England) -- Fiction, Anarchists -- Fiction, Allegories, Police -- Fiction",https://www.gutenberg.org/ebooks/1695,The Man Who Was Thursday: A Nightmare by G. K.  Chesterton (47),"Apr 1, 1999","[('said', 489), ('syme', 473), ('like', 256), ('man', 247), ('âi', 194), ('one', 192), ('could', 149), ('professor', 146), ('would', 118), ('face', 113), ('see', 98), ('gregory', 96), ('bull', 94), ('project', 91), ('old', 91), ('even', 91), ('seemed', 91), ('men', 88), ('âyou', 86), ('little', 85), ('great', 84), ('quite', 81), ('sunday', 80), ('looked', 77), ('long', 76), ('dr', 76), ('two', 75), ('upon', 75), ('asked', 75), ('still', 74)]"
3178,The Gilded Age: A Tale of Today by Mark Twain and Charles Dudley Warner (47),"Twain, Mark, 1835-1910","Jun 21, 2004",English,PS: Language and Literatures: American and Canadian literature,"Satire, Political fiction, Washington (D.C.) -- Fiction, Legislators -- Fiction, Speculation -- Fiction, Political corruption -- Fiction, Businessmen -- Fiction",https://www.gutenberg.org/ebooks/3178,The Gilded Age: A Tale of Today by Mark Twain and Charles Dudley Warner (47),"Jun 21, 2004","[('would', 660), ('said', 574), ('one', 499), ('could', 402), ('mr', 386), ('philip', 375), ('laura', 332), ('little', 327), ('washington', 321), ('man', 309), ('upon', 307), ('time', 291), ('â', 273), ('see', 271), ('never', 271), ('know', 270), ('good', 259), ('like', 256), ('go', 256), ('day', 231), ('say', 218), ('new', 218), ('harry', 218), ('dont', 212), ('ruth', 212), ('much', 211), ('made', 210), ('well', 208), ('hawkins', 207), ('senator', 203)]"
31,Plays of Sophocles: Oedipus the King; Oedipus at Colonus; Antigone by Sophocles (47),"Sophocles, 495? BCE-406 BCE","Mar 8, 2006",English,PA: Language and Literatures: Classical Languages and Literature,"Tragedies, Antigone (Mythological character) -- Drama, Oedipus (Greek mythological figure) -- Drama, Greek drama (Tragedy) -- Translations into English",https://www.gutenberg.org/ebooks/31,Plays of Sophocles: Oedipus the King; Oedipus at Colonus; Antigone by Sophocles (47),"Mar 8, 2006","[('thou', 479), ('oedipus', 471), ('thy', 337), ('thee', 278), ('creon', 230), ('chorus', 207), ('antigone', 150), ('man', 145), ('shall', 113), ('ye', 111), ('one', 108), ('may', 99), ('project', 88), ('must', 86), ('theseus', 85), ('us', 81), ('would', 79), ('messenger', 79), ('let', 79), ('come', 78), ('know', 77), ('ismene', 77), ('âtis', 72), ('king', 69), ('say', 69), ('son', 67), ('yet', 66), ('land', 65), ('state', 63), ('death', 62)]"
1170,Anabasis by Xenophon (47),"Xenophon, 431 BCE-350? BCE","Jan 1, 1998",English,DF: History: General and Eastern Hemisphere: Greece,"Classical literature, Iran -- History -- To 640, Cyrus, the Younger, approximately 423 B.C.-401 B.C., Greece -- History -- Expedition of Cyrus, 401 B.C.",https://www.gutenberg.org/ebooks/1170,,,
22566,Dorothy and the Wizard in Oz by L. Frank  Baum (47),Unknown,Unknown,Unknown,Unknown,,https://www.gutenberg.org/ebooks/22566,,,
28521,The Power of Mesmerism by Anonymous (47),Unknown,Unknown,Unknown,Unknown,,https://www.gutenberg.org/ebooks/28521,,,
65661,Der Zauberberg. Erster Band by Thomas Mann (47),"Mann, Thomas, 1875-1955","Jun 21, 2021",German,"PT: Language and Literatures: Germanic, Scandinavian, and Icelandic literatures","Germany -- Fiction, Sanatoriums -- Fiction",https://www.gutenberg.org/ebooks/65661,Der Zauberberg. Erster Band by Thomas Mann (47),"Jun 21, 2021","[('und', 5596), ('die', 3528), ('der', 2986), ('er', 2570), ('sie', 2199), ('es', 1882), ('zu', 1871), ('sich', 1791), ('das', 1775), ('mit', 1593), ('den', 1544), ('nicht', 1477), ('war', 1384), ('â', 1191), ('ein', 1154), ('auf', 1140), ('von', 1126), ('dem', 1102), ('ich', 1019), ('hans', 945), ('daã', 879), ('castorp', 871), ('wie', 867), ('ist', 859), ('aber', 819), ('im', 771), ('auch', 767), ('als', 767), ('hatte', 764), ('man', 737)]"
805,This Side of Paradise by F. Scott  Fitzgerald (47),"Fitzgerald, F. Scott (Francis Scott), 1896-1940","Feb 1, 1997",English,PS: Language and Literatures: American and Canadian literature,"Love stories, Bildungsromans, Young men -- Fiction, Children of the rich -- Fiction, Advertising -- Fiction, College students -- Fiction, World War, 1914-1918 -- Veterans -- Fiction",https://www.gutenberg.org/ebooks/805,This Side of Paradise by F. Scott  Fitzgerald (47),"Feb 1, 1997","[('amory', 778), ('one', 332), ('like', 207), ('said', 198), ('man', 182), ('rosalind', 182), ('would', 175), ('donât', 160), ('âi', 144), ('little', 143), ('iâm', 129), ('could', 128), ('know', 127), ('never', 120), ('two', 117), ('people', 115), ('go', 115), ('think', 113), ('great', 109), ('life', 107), ('eyes', 105), ('night', 103), ('men', 103), ('old', 102), ('back', 101), ('get', 100), ('much', 98), ('itâs', 97), ('want', 93), ('got', 91)]"
1658,Phaedo by Plato (47),"Plato, 427? BCE-347? BCE","Mar 1, 1999",English,"B: Philosophy, Psychology, Religion","Classical literature, Immortality (Philosophy) -- Early works to 1800",https://www.gutenberg.org/ebooks/1658,,,
4039,"Volpone; Or, The Fox by Ben Jonson (47)","Jonson, Ben, 1573?-1637","May 1, 2003",English,PR: Language and Literatures: English literature,"English drama (Comedy), Satire, English, Inheritance and succession -- Drama, English drama -- 17th century, Venice (Italy) -- Drama, Extortion -- Drama",https://www.gutenberg.org/ebooks/4039,,,
204,The Innocence of Father Brown by G. K.  Chesterton (47),"Chesterton, G. K. (Gilbert Keith), 1874-1936","Jul 9, 2008",English,PR: Language and Literatures: English literature,"England -- Fiction, Clergy -- Fiction, Detective and mystery stories, English, Catholics -- Fiction, Brown, Father (Fictitious character) -- Fiction",https://www.gutenberg.org/ebooks/204,The Innocence of Father Brown by G. K.  Chesterton (47),"Jul 9, 2008","[('said', 594), ('man', 347), ('like', 336), ('one', 317), ('brown', 284), ('father', 250), ('flambeau', 209), ('âi', 195), ('little', 170), ('could', 163), ('priest', 156), ('would', 151), ('two', 144), ('went', 132), ('face', 130), ('even', 127), ('looked', 116), ('know', 113), ('still', 111), ('cried', 107), ('last', 103), ('old', 102), ('head', 101), ('see', 101), ('back', 100), ('seemed', 100), ('round', 99), ('quite', 94), ('came', 94), ('something', 94)]"
10741,The Essays of Arthur Schopenhauer: the Wisdom of Life by Arthur Schopenhauer (47),"Schopenhauer, Arthur, 1788-1860","Jan 1, 2004",English,"B: Philosophy, Psychology, Religion","Conduct of life, Maxims",https://www.gutenberg.org/ebooks/10741,,,
3177,Roughing It by Mark Twain (46),"Twain, Mark, 1835-1910","Jul 3, 2004",English,PS: Language and Literatures: American and Canadian literature,"West (U.S.) -- Description and travel, Hawaii -- Description and travel, Twain, Mark, 1835-1910 -- Travel -- West (U.S.), Authors, American -- Homes and haunts -- West (U.S.), West (U.S.) -- Intellectual life -- 19th century",https://www.gutenberg.org/ebooks/3177,,,
24878,"Lucy Maud Montgomery Short Stories, 1909 to 1922 by L. M.  Montgomery (46)","Montgomery, L. M. (Lucy Maud), 1874-1942","Mar 19, 2008",English,PS: Language and Literatures: American and Canadian literature,"Short stories, Canadian",https://www.gutenberg.org/ebooks/24878,,,
70516,Now we are six by A. A.  Milne (46),"Milne, A. A. (Alan Alexander), 1882-1956","Apr 9, 2023",English,PZ: Language and Literatures: Juvenile belles lettres,"Children's poetry, English",https://www.gutenberg.org/ebooks/70516,Now we are six by A. A.  Milne (46),"Apr 9, 2023","[('project', 83), ('gutenbergâ', 61), ('said', 55), ('work', 45), ('one', 42), ('im', 42), ('little', 36), ('works', 33), ('john', 31), ('think', 30), ('pooh', 30), ('good', 29), ('may', 28), ('electronic', 27), ('gutenberg', 26), ('man', 25), ('say', 24), ('king', 24), ('go', 24), ('_round_', 24), ('terms', 22), ('know', 22), ('printing', 21), ('never', 21), ('states', 20), ('copyright', 20), ('like', 20), ('big', 20), ('lord', 20), ('foundation', 20)]"
56463,"Bacon's Essays, and Wisdom of the Ancients by Francis Bacon (46)",Unknown,Unknown,Unknown,Unknown,,https://www.gutenberg.org/ebooks/56463,"Bacon's Essays, and Wisdom of the Ancients by Francis Bacon (46)",Unknown,"[('upon', 387), ('great', 343), ('man', 331), ('may', 312), ('men', 308), ('one', 294), ('things', 238), ('good', 222), ('first', 209), ('like', 208), ('nature', 204), ('well', 173), ('yet', 172), ('much', 162), ('many', 159), ('without', 153), ('would', 152), ('time', 145), ('therefore', 143), ('though', 141), ('let', 134), ('bacon', 130), ('make', 130), ('shall', 127), ('use', 125), ('hath', 125), ('also', 124), ('state', 119), ('life', 118), ('work', 116)]"
14209,The Kybalion by Three Initiates (46),"Three Initiates, 1862-1932","Nov 29, 2004",English,"BF: Philosophy, Psychology, Religion: Psychology, Philosophy, Psychoanalysis","Occultism, Hermetism",https://www.gutenberg.org/ebooks/14209,,,
2040,Confessions of an English Opium-Eater by Thomas De Quincey (46),"De Quincey, Thomas, 1785-1859","Jan 1, 2000",English,PR: Language and Literatures: English literature,"Opium abuse -- England, Authors, English -- 19th century -- Biography, De Quincey, Thomas, 1785-1859, Drug addicts -- Great Britain -- Biography",https://www.gutenberg.org/ebooks/2040,Confessions of an English Opium-Eater by Thomas De Quincey (46),"Jan 1, 2000","[('opium', 129), ('one', 117), ('time', 110), ('upon', 102), ('could', 93), ('would', 92), ('project', 88), ('may', 88), ('must', 76), ('much', 74), ('even', 71), ('however', 69), ('might', 67), ('man', 65), ('reader', 62), ('part', 62), ('first', 59), ('yet', 59), ('many', 56), ('gutenbergtm', 56), ('years', 55), ('work', 54), ('london', 53), ('life', 50), ('without', 50), ('day', 50), ('great', 46), ('though', 46), ('often', 46), ('shall', 44)]"
72279,"Ornithological biography, Vol. 4 (of 5) : by John James Audubon (46)","Audubon, John James, 1785-1851","Dec 2, 2023",English,QL: Science: Zoology,Birds -- North America,https://www.gutenberg.org/ebooks/72279,"Ornithological biography, Vol. 4 (of 5) : by John James Audubon (46)","Dec 2, 2023","[('long', 896), ('end', 762), ('lower', 693), ('length', 659), ('species', 631), ('part', 626), ('tail', 619), ('twelfths', 618), ('inches', 612), ('birds', 609), ('wings', 588), ('white', 584), ('feathers', 556), ('upper', 555), ('bill', 551), ('rather', 516), ('small', 512), ('head', 512), ('one', 504), ('neck', 504), ('bird', 499), ('along', 493), ('short', 475), ('toe', 473), ('first', 472), ('much', 466), ('inch', 464), ('male', 463), ('young', 457), ('middle', 447)]"
4099,The Angel in the House by Coventry Patmore (46),"Patmore, Coventry, 1823-1896","May 1, 2003",English,PR: Language and Literatures: English literature,"Husband and wife -- Poetry, Women -- Conduct of life -- Poetry, Marriage -- Poetry",https://www.gutenberg.org/ebooks/4099,The Angel in the House by Coventry Patmore (46),"May 1, 2003","[('love', 207), ('project', 86), ('heart', 77), ('like', 68), ('life', 66), ('sweet', 61), ('gutenbergtm', 56), ('work', 53), ('1', 52), ('2', 52), ('yet', 50), ('preludes', 48), ('3', 46), ('would', 45), ('see', 43), ('thought', 43), ('one', 41), ('though', 41), ('could', 38), ('may', 37), ('still', 37), ('whose', 37), ('must', 37), ('grace', 36), ('wife', 36), ('made', 35), ('loveâs', 35), ('heaven', 35), ('good', 35), ('fair', 35)]"
3174,A Dog's Tale by Mark Twain (46),"Twain, Mark, 1835-1910","Jun 1, 2004",English,PS: Language and Literatures: American and Canadian literature,Dogs -- Fiction,https://www.gutenberg.org/ebooks/3174,,,
47276,"Gli eretici d'Italia, vol. I by Cesare Cantù (46)","Cantù, Cesare, 1804-1895","Nov 3, 2014",Italian,"BT: Philosophy, Psychology, Religion: Christianity: Doctrinal theology, God, Christology","Christian heretics, Christian heresies, Christian sects -- Italy, Reformation -- Italy",https://www.gutenberg.org/ebooks/47276,"Gli eretici d'Italia, vol. I by Cesare Cantù (46)","Nov 3, 2014","[('e', 7564), ('di', 5402), ('che', 4535), ('la', 3959), ('il', 3627), ('non', 2588), ('per', 1771), ('le', 1727), ('della', 1532), ('del', 1434), ('si', 1362), ('da', 1295), ('un', 1146), ('al', 1007), ('de', 939), ('gli', 931), ('ã', 897), ('come', 859), ('piã¹', 805), ('con', 751), ('alla', 748), ('se', 724), ('una', 692), ('chiesa', 661), ('nel', 653), ('dio', 557), ('delle', 542), ('ne', 525), ('lo', 511), ('nella', 497)]"
